title,penulis,cleaned_title
Perancangan Dan Implementasi Sistem Informasi Pencatatan Keuangan Proyek Konstruksi Berbasis Website Menggunakan Layanan Serverless (Studi Kasus: PT Tiga Putera Niscala),"Yerobal Gustaf Sekeon, Bayu Rahayudi, Dwija Wisnu Brata",perancangan dan implementasi sistem informasi pencatatan keuangan proyek konstruksi berbasis website menggunakan layanan serverless studi kasus pt tiga putera niscala
Perancangan Desain Antarmuka Pengguna Mobile Learning dengan Model Instruksional Gagne dan Pendekatan Human-Centered Design (Studi Kasus pada Mata Pelajaran Pemrograman Berorientasi Objek di SMK Negeri 6 Malang),"Syafira Aulia Wahdani, Retno Indah Rokhmawati, Hanifah Muslimah Az-Zahra",perancangan desain antarmuka pengguna mobile learning dengan model instruksional gagne dan pendekatan humancentere design studi kasus pada mata pelajaran pemrograman berorientasi objek di smk negeri 6 malang
Perancangan Desain Interaksi Modul Asesmen dan Modul Pengembangan Karir pada Aplikasi Sarjana Sakti menggunakan Metode Design Thinking dan Heuristic Evaluation,"Tita Alfiana, Herman  Tolle, Retno Indah Rokhmawati",perancangan desain interaksi modul asesmen dan modul pengembangan karir pada aplikasi sarjana sakti menggunakan metode design thinking dan heuristic evaluation
Perancangan Desain Pengalaman Pengguna Aplikasi Orino Care Berbasis Mobile dengan Menggunakan Pendekatan Design Thinking,"Harits Jundulloh, Herman Tolle, Buce Trias Hanggara",perancangan desain pengalaman pengguna aplikasi orino care berbasis mobile dengan menggunakan pendekatan design thinking
Perancangan Development Cycle Over The Air pada Sistem IoT berbasis Teknologi Container,"Rifki Karim Ramadhan, Sabriansyah Rizqika Akbar, Achmad Basuki",perancangan development cycle air pada sistem iot berbasis teknologi container
"Perancangan Implementasi Tampilan Baru Web ""Sambat"" Kota Malang menggunakan Metode Design Thinking","Veby Angelia Ropita Turnip, Herman Tolle, Dwi Cahya Astriya Nugraha",perancangan implementasi tampilan baru web sambat kota malang menggunakan metode design thinking
Perancangan Interaksi Aplikasi Tes Minat Bakat Daring untuk Firma Psikologi Jejak Kaki dengan Metode Goal-Directed Design,"Pamostang William Richard Hamonangan, Ismiarta Aknuranda",perancangan interaksi aplikasi te minat bakat dare untuk firma psikologi jejak kaki dengan metode goaldirecte design
Perancangan Interaksi Sistem Manajemen Kos Dengan Metode Design Thinking (Studi Kasus: Kos Arga Wilis),"Daniel Indra Sasongko, Hanifah Muslimah  Az-Zahra, Buce Trias Hanggara",perancangan interaksi sistem manajemen kos dengan metode design thinking studi kasus kos arga wili
Perancangan Interaksi Terhadap Sistem Informasi Pendukung Proses Bisnis Percetakan Menggunakan Metode Human Centered Design: Kasus CV Wins Advertising,"Della Akhidatul Izzah, Ismiarta Aknuranda",perancangan interaksi terhadap sistem informasi pendukung prose bisni percetakan menggunakan metode human center design kasus cv win advertising
Perancangan Interaksi Untuk Talent Management System Di Sub Unit Human Capital Communication & Employer Branding PT Telkom Indonesia (Persero) Tbk Menggunakan Goal-Directed Design,"Imelda Fransisca S, Ismiarta Aknuranda, Buce Trias Hanggara",perancangan interaksi untuk talent management system di sub unit human capital communication   employer brand pt telkom indonesia persero tbk menggunakan goaldirecte design
Perancangan Interaksi dan Antarmuka Pengguna Aplikasi Monitoring Lesson Study berbasis Web menggunakan Pendekatan Human-Centered Design,"Moch. Rizal Effendi, Retno Indah  Rokhmawati, Wibisono Sukmo  Wardhono",perancangan interaksi dan antarmuka pengguna aplikasi monitor lesson study berbasis web menggunakan pendekatan humancentere design
Perancangan Interaksi untuk Sistem Manajemen Akun Sistem Informasi di Universitas Brawijaya dengan Kerangka Goal-Directed Design,"Fatih Meru Samudra, Ismiarta Aknuranda",perancangan interaksi untuk sistem manajemen akun sistem informasi di universitas brawijaya dengan kerangka goaldirecte design
Perancangan Lokalisasi Pada Robot Humanoid Sepak Bola  Menggunakan Metode Visual-Inertial Odometry (VIO),"alvin ferdiansyah, Gembong Edhi Setyawan",perancangan lokalisasi pada robot humanoid sepak bola   menggunakan metode visualinertial odometry vio
Perancangan Mekanik Gim Edukasi Kimia Tabel Periodik Unsur Menggunakan Metode Iterative dan Rapid Prototyping,"Davin Benaya, Tri Afirianto, Muhammad Aminul Akbar",perancangan mekanik gim edukasi kimia tabel periodik unsur menggunakan metode iterative dan rapid prototyping
Perancangan Model Artificial Neural Network untuk Klasifikasi Posisi Jatuh Robot Humanoid Dengan Sensor IMU,"Eldon Parasian Simanjuntak, Gembong",perancangan model artificial neural network untuk klasifikasi posisi jatuh robot humanoid dengan sensor imu
Perancangan Modul Tambahan Portal Media Interaksi Sivitas Universitas Brawijaya bagi Alumni Universitas Brawijaya menggunakan Design Thinking,"Budi Iswanto, Herman Tolle, Retno Indah Rokhmawati",perancangan modul tambahan portal medium interaksi sivita universitas brawijaya bagi alumnus universitas brawijaya menggunakan design thinking
Perancangan Monitoring Sistem Pembatasan Jumlah Pengguna pada Pelayanan Publik menggunakan Naive Bayes untuk Antisipasi Kerumunan,"Dias Alfan Nur Ilham, Mochammad Hannats Hanafi Ichsan, Eko Setiawan",perancangan monitor sistem pembatasan jumlah pengguna pada pelayanan publik menggunakan naive baye untuk antisipasi kerumunan
Perancangan Pengalaman Pengguna Aplikasi Agen Perjalanan menggunakan Design Thinking: Kasus Morvin Tour & Travel,"Jessica Ayu Trinovanti, Ismiarta Aknuranda",perancangan pengalaman pengguna aplikasi agen perjalanan menggunakan design thinking kasus morvin tour   travel
Perancangan Pengalaman Pengguna Aplikasi Bergerak Deteksi Dini Gangguan Kecemasan Menggunakan Metode Design Thinking,"Raya Aldyen Dessario, Lutfi Fanani, Mahardeka Tri Ananta",perancangan pengalaman pengguna aplikasi bergerak deteksi dini gangguan kecemasan menggunakan metode design thinking
Perancangan Pengalaman Pengguna Aplikasi Human Resources Menggunakan Metode User-Centered Design,"Maulana Zidhan  Firmansyah, Agi Putra Kharisma, Lutfi  Fanani",perancangan pengalaman pengguna aplikasi human resource menggunakan metode usercentered design
Perancangan Pengalaman Pengguna Aplikasi Jasa Haji dan Umrah Berbasis Website Menggunakan Metode Design Thinking (Studi Kasus: PT Global Tour & Travel),"TSABITA MUTHIA AYU PRAMESTI, HERMAN TOLLE, BAYU  PRIYAMBADHA",perancangan pengalaman pengguna aplikasi jasa haji dan umrah berbasis website menggunakan metode design thinking studi kasus pt global tour   travel
Perancangan Pengalaman Pengguna Aplikasi Keuangan Organisasi berbasis Mobile (Studi Kasus : LO/LSO FILKOM UB) menggunakan Metode Design Thinking,"Khairunnisa' Rahmadhanti, Buce Trias Hanggara, Kariyoto Kariyoto",perancangan pengalaman pengguna aplikasi keuangan organisasi berbasis mobile studi kasus   lolso filkom ub menggunakan metode design thinking
Perancangan Pengalaman Pengguna Aplikasi Kursus Online Teknologi Informasi berbasis Mobile menggunakan Metode Human-Centered Design,"Tony Andhika Mahendra, Riswan Septriayadi Sianturi, Agi Putra Kharisma",perancangan pengalaman pengguna aplikasi kursus online teknologi informasi berbasis mobile menggunakan metode humancentere design
Perancangan Pengalaman Pengguna Aplikasi Layanan Ambulans Puskesmas Sumberpucung Kabupaten Malang Menggunakan Human-Centered Design,"Alistya Fikri Pratondo, Agi Putra Kharisma, Mahardeka Tri Ananta",perancangan pengalaman pengguna aplikasi layanan ambulans puskesmas sumberpucung kabupaten malang menggunakan humancentered design
Perancangan Pengalaman Pengguna Aplikasi Mobile Penyaluran Sampah Masker Medis menggunakan Metode Design Thinking (Studi Kasus: Dumask Indonesia),"Aulia Megha Ramadhani, Lufti Fanani, Hanifah Muslimah Az-Zahra",perancangan pengalaman pengguna aplikasi mobile penyaluran sampah masker medis menggunakan metode design thinking studi kasus dumask indonesia
Perancangan Pengalaman Pengguna Aplikasi Mobile Perencanaan Liburan Menggunakan Metode Design Thinking,"Raihan Alif Nurdianto, Eriq Muhammad Adams Jonemaro, Mahardeka Tri Ananta",perancangan pengalaman pengguna aplikasi mobile perencanaan liburan menggunakan metode design thinking
Perancangan Pengalaman Pengguna Aplikasi Mobile Platform Potensia menggunakan Metode Design Thinking,"Alfina Ayu Aulia, Retno Indah Rokhmawati, Mochamad Chandra Saputra",perancangan pengalaman pengguna aplikasi mobile platform potensia menggunakan metode design thinking
Perancangan Pengalaman Pengguna Aplikasi Online Course Sharing Digital Marketing sebagai Platform Belajar Digital Marketing menggunakan Metode Design Thinking (Studi Kasus : Mi Studio),"Fadira Bima Syahril, Agi Putra Kharisma, Mahardeka Tri Ananta",perancangan pengalaman pengguna aplikasi online course share digital marketing sebagai platform belajar digital marketing menggunakan metode design thinking studi kasus   mi studio
Perancangan Pengalaman Pengguna Aplikasi Pemesanan Makanan Tradisional Padang Menggunakan Metode Design Thinking (Studi Kasus: UMKM Sindifood Jakarta),"Poppy Marcelia Aziza, Agi Putra  Kharisma, Mahardeka Tri Ananta",perancangan pengalaman pengguna aplikasi pemesanan makanan tradisional padang menggunakan metode design thinking studi kasus umkm sindifood jakarta
Perancangan Pengalaman Pengguna Aplikasi Penagihan Iuran oleh Kader Jaminan Kesehatan Nasional (JKN) dengan Metode Human-Centered Design (Studi Kasus Badan Penyelenggara Jaminan Sosial (BPJS) Kesehatan Kantor Cabang Kota Malang),"Elsa Chintia Agriani, Riswan Septriayadi Sianturi, Agi Putra Kharisma",perancangan pengalaman pengguna aplikasi penagihan iuran oleh kader jaminan kesehatan nasional jkn dengan metode humancentere design studi kasus badan penyelenggara jaminan sosial bpjs kesehatan kantor cabang kota malang
Perancangan Pengalaman Pengguna Aplikasi Penyewaan Alat Foto dan Video berbasis Website menggunakan Pendekatan Human Centered Design (HCD) (Studi Kasus: Aceh Camera),"Miftahul Ihsan, Agi Putra Kharisma, Adam Hendra  Brata",perancangan pengalaman pengguna aplikasi penyewaan alat foto dan video berbasis website menggunakan pendekatan human center design hcd studi kasus aceh camera
Perancangan Pengalaman Pengguna Aplikasi Perangkat Bergerak Lelang Aset Online menggunakan Metode User Centered Design (UCD) dan Metode Think Aloud (Studi Kasus: PT. Bank Rakyat Indonesia (Persero) Tbk Regional Office Malang),"Hafizh Daffa Septianto, Agi Putra Kharisma, Dwija Wisnu Brata",perancangan pengalaman pengguna aplikasi perangkat bergerak lelang aset online menggunakan metode user centered design ucd dan metode think aloud studi kasus pt bank rakyat indonesia persero tbk regional office malang
Perancangan Pengalaman Pengguna Aplikasi Perangkat Bergerak Pencarian Informasi Praktik Mandiri Dokter Spesialis di Kota Mataram,"Lalu Alfitra Kallatida  Muhamad, Lutfi Fanani, Hanifah Muslimah Az-Zahra",perancangan pengalaman pengguna aplikasi perangkat bergerak pencarian informasi praktik mandiri dokter spesialis di kota mataram
Perancangan Pengalaman Pengguna Aplikasi Personal Shopper menggunakan Metode Human-Centered Design,"Febryana Roma Uli Marpaung, Riswan Septriayadi Sianturi, Agi Putra Kharisma",perancangan pengalaman pengguna aplikasi personal shopper menggunakan metode humancentere design
Perancangan Pengalaman Pengguna Aplikasi Presensi dan Penilaian Akademik Santri menggunakan Metode User-Centered Design (Studi Kasus: Pondok Pesantren Anwarul Huda Malang),"Agus Nugroho, Eriq Muhammad Adams Jonemaro, Mahardeka Tri Ananta",perancangan pengalaman pengguna aplikasi presensi dan penilaian akademik santri menggunakan metode usercentered design studi kasus pondok pesantren anwarul huda malang
Perancangan Pengalaman Pengguna Aplikasi Rental Printer dengan Metode Design Thinking (Studi Kasus: Print Pojok UNESA Ketintang Surabaya),"Nata Nirwasita  Rasendriya, Agi Putra Kharisma, Mahardeka Tri Ananta",perancangan pengalaman pengguna aplikasi rental printer dengan metode design thinking studi kasus print pojok unesa ketintang surabaya
Perancangan Pengalaman Pengguna Aplikasi Sewa Sepeda Motor menggunakan Metode Human-Centered Design (Studi Kasus : Rent-A-Motor Malang),"Fahmi Akbar Muzakky, Riswan Septriayadi Sianturi, Mahardeka Tri Ananta",perancangan pengalaman pengguna aplikasi sewa sepeda motor menggunakan metode humancentere design studi kasus   rentamotor malang
Perancangan Pengalaman Pengguna Aplikasi e-Commerce berbasis Website untuk Pembelian Photobook menggunakan Metode Design Thinking (Studi Kasus: Abstory),"Salsabila Imania Achmad, Herman Tolle, Dwi Cahya Astriya Nugraha",perancangan pengalaman pengguna aplikasi ecommerce berbasis website untuk pembelian photobook menggunakan metode design thinking studi kasus abstory
Perancangan Pengalaman Pengguna Curriculum Vitae Generator Menggunakan Human Centered Design: Kasus Di Universitas Brawijaya,"Aisyah Maharani, Ismiarta Akrunanda, Retno Rokhmawati",perancangan pengalaman pengguna curriculum vitae generator menggunakan human center design kasus di universitas brawijaya
Perancangan Pengalaman Pengguna E-Learning Pendamping Pelatihan Cybersecurity,"Eurico Krisna Wijaya, Lutfi  Fanani, Bayu  Priyambadha",perancangan pengalaman pengguna elearning pendampe pelatihan cybersecurity
Perancangan Pengalaman Pengguna Situs Web Jasa Layanan Importir menggunakan Metode Design Thinking (Studi Kasus: PT Dian Sentosa Abadi),"Krishna Yudie Aqilla Iqbal, Buce Trias Hanggara, Intan Sartika Eris Maghfiroh",perancangan pengalaman pengguna situs web jasa layanan importir menggunakan metode design thinking studi kasus pt dian sentosa abadi
Perancangan Pengalaman Pengguna pada Aplikasi Pemesanan Jadwal Potong Rambut Barbershop di Kota Gresik dengan menggunakan Metode Human-Centered Design,"Muhammad Misbachul Asrori, Agi Putra Kharisma, Candra Dewi",perancangan pengalaman pengguna pada aplikasi pemesanan jadwal potong rambut barbershop di kota gresik dengan menggunakan metode humancentere design
Perancangan Pengalaman Pengguna pada Aplikasi Perangkat Bergerak Peminjaman Peralatan Penunjang Pariwisata menggunakan Metode Design Thinking (Studi Kasus: Rentrips.id),"Muhammad Bintang Prabowo, Komang Candra Brata, Mahardeka Tri  Ananta",perancangan pengalaman pengguna pada aplikasi perangkat bergerak peminjaman peralatan penunjang pariwisata menggunakan metode design thinking studi kasus rentripsid
Perancangan Pengalaman Pengguna pada Aplikasi Pesan Makanan dari Meja menggunakan Metode Design Thinking (Studi Kasus: Mie Gacoan Kota Madiun),"Anargya Hassya Budidarwanto, Agi Putra Kharisma, Fais Al Huda",perancangan pengalaman pengguna pada aplikasi pesan makanan dari meja menggunakan metode design thinking studi kasus mie gacoan kota madiun
Perancangan Platformer Game Digital dengan Tema Sejarah Kedatangan Belanda di Indonesia menggunakan Mechanics Dynamics Aesthetics Framework,"Vindu Cahya Nugraha, Eriq Muhammad Adams Jonemaro, Tri Afirianto",perancangan platformer game digital dengan tema sejarah kedatangan belanda di indonesia menggunakan mechanics dynamic aesthetic framework
Perancangan Proses Bisnis dan Analisis Spesifikasi Persyaratan Sistem Informasi Pemesanan Layanan: Kasus CV Usaha Berkah Abadi,"Ferdiansyah Dicky Prayoga, Ismiarta Aknuranda",perancangan prose bisnis dan analisis spesifikasi persyaratan sistem informasi pemesanan layanan kasus cv usaha berkah abadi
Perancangan Prototype Sistem Informasi Administrasi Sekolah Berbasis Web pada Sekolah Menengah Pertama Negeri 1 Lamasi,"Novi Teoktista, Hanifah Muslimah  Az-Zahra, Almira Syawli",perancangan prototype sistem informasi administrasi sekolah berbasis web pada sekolah menengah pertama negeri 1 lamasi
Perancangan Purwarupa Aplikasi Pembayaran Iuran Komite Sekolah (Studi Kasus: SMK Negeri 5 Malang),"Maria Imaculata Astrid Wahyuningtyas, Hanifah Muslimah Az-Zahra, Almira Syawli",perancangan purwarupa aplikasi pembayaran iuran komite sekolah studi kasus smk negeri 5 malang
Perancangan Service Design Website Pemesanan Catering Pawon Mendut 33 Menggunakan Metode TiSDD Framework,"Azura Fairuz Bariq, Herman Tolle, Dwi Cahya Astriya Nugraha",perancangan service design website pemesanan cater pawon mendut 33 menggunakan metode tisdd framework
Perancangan Sistem Aplikasi Pengelolaan Pergudangan berbasis Web dengan Metode Human Centered Design (Studi Kasus: CV Lantikya),"Mohammad Alif Alfattah, Hanifah Muslimah Az-Zahra, Almira  Syawli",perancangan sistem aplikasi pengelolaan pergudangan berbasis web dengan metode human center design studi kasus cv lantikya
Perancangan Sistem Deteksi Anomali pada Panel Surya menggunakan Mikrokontroler dengan Algoritma K-Nearest Neighbors,"Fachry Ananta, Dahnial Syauqy, Barlian Henryranu Prasetio",perancangan sistem deteksi anomali pada panel surya menggunakan mikrokontroler dengan algoritma knearest neighbor
Perancangan Sistem Deteksi Node Baru Otomatis dalam Basis ESP-NOW dengan Tree Topology WSN,"Varaz Adolfo, Agung Setia Budi",perancangan sistem deteksi node baru otomatis dalam basis espnow dengan tree topology wsn
Perancangan Sistem Informasi Gadai Pada KORMA,Marisa Sirait,perancangan sistem informasi gadai pada korma
Perancangan Sistem Informasi Manajemen Pendataan Pengungsi dan Logistik berbasis Web (Studi Kasus : Badan Penanggulangan Bencana Daerah Kota Batu),"Alfeda Ivan Widiaputra, Riswan Septriayadi Sianturi, Agi Putra Kharisma",perancangan sistem informasi manajemen pendataan pengungsi dan logistik berbasis web studi kasus   badan penanggulangan bencana daerah kota batu
Perancangan Sistem Informasi Web Admin Monitoring Energi Berbasis Dummy Load Internet Of Thing Untuk Pengambilan Keputusan PT. Myeco Teknologi Nusantara,"Robbi Al Fianto, Yusi Tyroni Mursityo, Buce Trias Hanggara",perancangan sistem informasi web admin monitoring energi berbasis dummy load internet thing untuk pengambilan keputusan pt myeco teknologi nusantara
Perancangan Sistem Manajemen Toko berbasis Web (Studi Kasus pada Toko Mebel Sampoerna),"Prama Pradipta Adiwignya, Nurudin Santoso",perancangan sistem manajemen toko berbasis web studi kasus pada toko mebel sampoerna
Perancangan Sistem Node berbasis ESP32 dengan Fitur Isi Ulang Baterai dan Berdaya Rendah menggunakan Processor State Control,"Juan Ignasio Vonda Santana, Sabriansyah Rizqika Akbar",perancangan sistem node berbasis esp32 dengan fitur isi ulang baterai dan berdaya rendah menggunakan processor state control
Perancangan Sistem Pemantauan Suhu dan Kelembaban Ruangan berbasis Wireless Sensor Network,"Bagasdio Sutrisno, Kasyful Amron, Reza Andria Siregar",perancangan sistem pemantauan suhu dan kelembaban ruangan berbasis wireless sensor network
Perancangan Sistem Pendukung Keputusan Pemilihan Menu Pendamping ASI Dengan Metode MOORA,"Alan Hartawan, Indriati, Edy Santoso",perancangan sistem pendukung keputusan pemilihan menu pendamping asi dengan metode moora
Perancangan Sistem Peningkatan Performa Panel Surya dengan Pengendalian Suhu Permukaan untuk Meningkatkan Output Daya,"Rahagi Abdu Baariu, Barlian Henryranu Prasetio",perancangan sistem peningkatan performa panel surya dengan pengendalian suhu permukaan untuk meningkatkan output daya
Perancangan UI Ftitur Absensi Ulang Otomatis dan Rekap Gaji Aplikasi Mekari Talenta Menggunakan Design Thinking dan UEQ,christine sutanto,perancangan ui ftitur absensi ulang otomatis dan rekap gaji aplikasi mekari talenta menggunakan design thinking dan ueq
Perancangan UI/UX Website Kerajinan Tangan Crafinta Dengan Menggunakan Metode Human Centered Design,"Novia Saraswati, Hanifah Az-Zahra, Prima Zulvarina",perancangan uiux website kerajinan tangan crafinta dengan menggunakan metode human center design
Perancangan UX Aplikasi Pemesanan Makanan dan Minuman dari Meja menggunakan Metode Design Thinking (Studi Kasus: Kedai Kopi Sarijan Malang),"Ridho Aqli Efendi, Agi Putra Kharisma, Mahardeka Tri Ananta",perancangan ux aplikasi pemesanan makanan dan minuman dari meja menggunakan metode design thinking studi kasus kedai kopi sarijan malang
Perancangan UX Modul Orang tua pada Aplikasi Bimbingan Online Mahasiswa FILKOM UB menggunakan Metode Design Thinking,"Devina Dwi Pratiwi, Herman Tolle, Denny Sagita Rusdianto",perancangan ux modul orang tua pada aplikasi bimbingan online mahasiswa filkom ub menggunakan metode design thinking
Perancangan Ulang Antarmuka Pengguna Aplikasi Helpdesk Halo Filkom Menggunakan Metode Human Centered Design,"Dwi Vebriansyah, Muslimah, Prima  Zulvarina",perancangan ulang antarmuka pengguna aplikasi helpdesk halo filkom menggunakan metode human center design
Perancangan User Experience Alat Ukur Evaluasi Pengalaman Pengguna Metode Intrinsic Motivation Inventory berbasis Website (Studi Kasus : Diskominfo Ngawi),"Annisa Sukmawati, Mahardeka Tri Ananta, Dwija Wisnu Brata",perancangan user experience alat ukur evaluasi pengalaman pengguna metode intrinsic motivation inventory berbasis website studi kasus   diskominfo ngawi
Perancangan User Experience Aplikasi Berbagi Makanan Berbasis Mobile Dengan Metode Design Thinking (Studi Kasus: Garda Pangan),"Muhammad Sahlan Shadiq, Herman Tolle, Bayu Priyambadha",perancangan user experience aplikasi berbagi makanan berbasis mobile dengan metode design thinking studi kasus garda pangan
Perancangan User Experience Aplikasi Berbasis Mobile Pada Kiara Coffee dengan Metode Design Thinking,"Muhammad Fardan Fauzan, Hanifah Muslimah Az-Zahra, Niken Hendrakusma Wardani",perancangan user experience aplikasi berbasis mobile pada kiara coffee dengan metode design thinking
Perancangan User Experience Aplikasi Binar Academy pada Aspek Stimulasi menggunakan Design Thinking,"Annisa Nabila Salma Hartanto, Buce Trias Hanggara, Bondan Sapta Prakoso",perancangan user experience aplikasi binar academy pada aspek stimulasi menggunakan design thinking
Perancangan User Experience Aplikasi Creative Service Marketplace berbasis Mobile dengan Metode Design Thinking,"Naufal Alif Aldhian, Herman Tolle",perancangan user experience aplikasi creative service marketplace berbasis mobile dengan metode design thinking
Perancangan User Experience Aplikasi Dibimbing.id menggunakan Metode Design Thinking,"Muhammad Nurhidayat, Herman Tolle",perancangan user experience aplikasi dibimbingid menggunakan metode design thinking
Perancangan User Experience Aplikasi Donation Based Crowdfunding dengan Metode Design Thinking,Deanka Silaban,perancangan user experience aplikasi donation base crowdfunde dengan metode design thinking
"Perancangan User Experience Aplikasi E-Commerce Bibit Tanaman berbasis Mobile menggunakan Design Thinking (Studi Kasus : Desa Sananrejo, Kecamatan Turen, Kabupaten Malang)","Ibnu Najah Barlian Hadi Utomo, Komang Candra Brata, Muhammad Aminul Akbar",perancangan user experience aplikasi ecommerce bibit tanaman berbasis mobile menggunakan design thinking studi kasus   desa sananrejo kecamatan turen kabupaten malang
Perancangan User Experience Aplikasi Edukasi Dan Penanganan Anxiety Disorder Pada Mahasiswa Filkom Menggunakan Metode Human Centered Design (HCD),Dian Ayu Rahmawati,perancangan user experience aplikasi edukasi dan penanganan anxiety disorder pada mahasiswa filkom menggunakan metode human center design hcd
Perancangan User Experience Aplikasi Edukasi Perawatan Osteoarthritis menggunakan Metode Design Thinking,"Arif Wiranata, Herman Tolle, Fais Al Huda",perancangan user experience aplikasi edukasi perawatan osteoarthritis menggunakan metode design thinking
Perancangan User Experience Aplikasi Go UMKM by BSI Berbasis Mobile Menggunakan Metode Human Centered Design (HCD),"Althaf Taqy Rizky Rosaldy, Hanifah Muslimah  Az-Zahra, Niken Hendrakusma Wardani",perancangan user experience aplikasi umkm bsi berbasis mobile menggunakan metode human center design hcd
Perancangan User Experience Aplikasi Jasa Foto Produk menggunakan Human Centered Design,"Hafiz Azhari Aritonang, Riswan Septriayadi  Sianturi, Agi Putra Kharisma",perancangan user experience aplikasi jasa foto produk menggunakan human center design
Perancangan User Experience Aplikasi Keanggotaan Indonesian Heritage Society (IHS) berbasis Aplikasi Mobile dengan Pendekatan Human-Centered Design,"Kevin Judhistira Girsang, Herman Tolle, Retno Indah Rokhmawati",perancangan user experience aplikasi keanggotaan indonesian heritage society ihs berbasis aplikasi mobile dengan pendekatan humancentere design
Perancangan User Experience Aplikasi Kesehatan untuk Menentukan Menu Makanan Sehat (Studi Kasus: Mahasiswa Universitas Brawijaya),"Syahida Usama Firdaus, Lutfi Fanani, Herman Tolle",perancangan user experience aplikasi kesehatan untuk menentukan menu makanan sehat studi kasus mahasiswa universitas brawijaya
Perancangan User Experience Aplikasi Learning Management System dengan Metode Human-Centered Design (Studi Kasus: IPB Consulting),"Rafid Ardito, Lutfi Fanani, Fais  Al Huda",perancangan user experience aplikasi learn management system dengan metode humancentere design studi kasus ipb consulting
Perancangan User Experience Aplikasi Manajemen Distribusi Pupuk Subsidi menggunakan Metode Human-Centered Design (Studi Kasus: Kios Pesona Tunggulwulung Kecamatan Lowokwaru),"Dirgahayu Tyas Maghfiroh, Riswan Septriayadi Sianturi, Agi Putra Kharisma",perancangan user experience aplikasi manajeman distribusi pupuk subsidi menggunakan metode humancentere design studi kasus kios pesona tunggulwulung kecamatan lowokwaru
Perancangan User Experience Aplikasi Manajemen Pendaftaran Pasien Berbasis Mobile Pada Rumah Sakit Bersalin Restu Ibu Padang Menggunakan Metode Design Thinking,"Naufal Dzaky, Herman Tolle, Dwi Cahya Astriya Nugraha",perancangan user experience aplikasi manajemen pendaftaran pasien berbasis mobile pada rumah sakit bersalin restu ibu padang menggunakan metode design thinking
