title,penulis,cleaned_title
Aanlisis Prediksi Kemampuan Pembayaran Klien Home Credit Indonesia dalam Membayar Pinjaman dengan Metode Random Forest Classifier,"Abrilian Maulidhia, Bayu Rahayudi, Welly Purnomo",aanlisis prediksi kemampuan pembayaran klien home credit indonesia dalam membayar pinjaman dengan metode random forest classifier
Akses Kendaraan pada Perumahan menggunakan Bluetooth Low Energy,"Zulfi Alfariz, Agung Setia Budi",akse kendaraan pada perumahan menggunakan bluetooth low energy
Alasan Penurunan Popularitas dari Video Game Free Fire: Analisis Kasus dari Perspektif Pemain Game,"Arif Bagus Setiawan, Ismiarta Aknuranda, Andi Reza Perdanakusuma",alasan penurunan popularitas dari video game free fire analisis kasus dari perspektif pemain game
Alat Monitoring Pertanian Padi Dengan Sistem Low Power Guna Menunjang Efisiensi Baterai,"Stanislaus Angeswara, Agung Setia Budi, S.T., M.T., M.Eng., Ph.D.",alat monitor pertanian padi dengan sistem low power guna menunjang efisiensi baterai
Alat Ukur Berat dan Volume Buah Menggunakan Multi Sensor Ultrasonik dan Metode Regresi Linier Berganda Berbasis Arduino Uno,Crystina Wijayanti,alat ukur berat dan volume buah menggunakan multi sensor ultrasonik dan metode regresi lini berganda berbasis arduino uno
Analisa Perbandingan Performa Framework Web Server Nest JS Dan Hapi JS Berbasis REST API,"Mukhammad Afan Oktafianto, Buce Trias Hanggara, Muhammad Aminul Akbar",analisa perbandingan performa framework web server nest js dan hapi js berbasis rest api
Analisis Adopsi Pengguna Kelompok Usia Muda pada Integrasi Layanan Pembayaran GoPay di Aplikasi Tokopedia menggunakan Model UTAUT2 & TTF,"Hanifa Putri Rahima, Buce Trias Hanggara, Widhy Hayuhardhika Nugraha  Putra",analisis adopsi pengguna kelompok usia muda pada integrasi layanan pembayaran gopay di aplikasi tokopedia menggunakan model utaut2   ttf
Analisis Adopsi Pengguna Weverse Shop terhadap Integrasi Pembayaran dengan Aplikasi DANA menggunakan Model Unified Theory of Acceptance and Use of Technology 2 (UTAUT2),"Ghina Zahirah, Buce Trias Hanggara, Widhy Hayuhardhika Nugraha Putra",analisis adopsi pengguna weverse shop terhadap integrasi pembayaran dengan aplikasi dana menggunakan model unify theory acceptance use technology 2 utaut2
Analisis Akar Permasalahan  Kepuasan Tamu Hotel Savana Berdasarkan Sentimen Negatif,"Alexander Christo Setiawan, Dian Eka Ratnawati, Welly Purnomo",analisis akar permasalahan   kepuasan tamu hotel savana berdasarkan sentimen negatif
"Analisis Aksesibilitas Website Kabupaten Malang, Kota Malang, dan Kota Batu Berdasarkan Kriteria Web Content Accessibility Guide (WCAG) Untuk Pengguna Disabilitas Tuna Netra","Rakha Hanif Maheswara, Herman Tolle, Nurudin Santoso",analisis aksesibilita website kabupaten malang kota malang dan kota batu berdasarkan kriteria web content accessibility guide wcag untuk pengguna disabilitas tuna netra
Analisis Arsitektur State Management Vuex dan Pinia pada Framework Progresif JavaScript Vue.js,"Octavia Lintang Pramesti, Aryo  Pinandito",analisis arsitektur state management vuex dan pinia pada framework progresif javascript vuejs
Analisis Association Rule pada Faktor Eksternal dan Prestasi Belajar Terhadap Tingkat Stres Mahasiswa Menggunakan Algoritma Apriori,"Muhammad Alifandi Abiyyu, Satrio Hadi Wijoyo, Satrio Agung Wicaksono",analisis association rule pada faktor eksternal dan prestasi belajar terhadap tingkat stre mahasiswa menggunakan algoritma apriori
Analisis Clustering Topik Survey menggunakan Algoritme K-Means (Studi Kasus: Kudata),"Muhammad Arienal Haq, Welly Purnomo, Nanang Yudi Setiawan",analisis cluster topik survey menggunakan algoritme kmeans studi kasus kudata
Analisis Color Space untuk Spesifikasi Perancangan Perangkat Lunak pada Embedded System Deteksi Penyakit Busuk Selada,"Muhammad Fatham Mubina Akbar, Hurriyatul Fitriyah, Sabriansyah Rizqika Akbar",analisis color space untuk spesifikasi perancangan perangkat lunak pada embed system deteksi penyakit busuk selada
Analisis Dan Evaluasi Proses Bisnis Menggunakan Lean Six Sigma Framework (Studi Kasus: Orino Pet Shop),"Dennis Hans Albertian, Andi Reza Perdanakusuma, Niken Hendrakusuma Wardani",analisis dan evaluasi prose bisnis menggunakan lean sigma framework studi kasus orino pet shop
Analisis Efektivitas dan Efisiensi Algoritma Constraint Satisfaction Problem (CSP) dalam Penjadwalan Ekstrakurikuler,"Annisa Aristawati, Fajar Pradana, Mochamad Chandra Saputra",analisis efektivita dan efisiensi algoritma constraint satisfaction problem csp dalam penjadwalan ekstrakurikuler
Analisis Estimasi Tarikan Gerakan Terhadap Gerakan Mengenggam Berbagai Objek Pada Prostetik Tangan Bionik Menggunakan Regresi Linier,"Abim Renara Palwa Luktagara, Bu Edita",analisis estimasi tarikan gerakan terhadap gerakan mengenggam berbagai objek pada prostetik tangan bionik menggunakan regresi linier
Analisis Faktor Push-Pull-Mooring dalam Beralih Penggunaan Centralized Exchange (CEX) Cryptocurrency Indonesia ke CEX Internasional,"Kevin Setyadi, Satrio Agung Wicaksono, Andi Reza Perdanakusuma",analisis faktor pushpullmooring dalam beralih penggunaan centralized exchange cex cryptocurrency indonesia ke cex internasional
Analisis Faktor yang Memengaruhi Penggunaan Cryptocurrency Menggunakan Unified Theory of Acceptance and use of Technology (UTAUT) Termodifikasi (Studi Kasus Pada Generasi Z di DKI Jakarta),"Putri Nabilah Hanun, Satrio Hadi Wijoyo, Aditya Rachmadi",analisis faktor yang memengaruhi penggunaan cryptocurrency menggunakan unified theory acceptance use technology utaut termodifikasi studi kasus pada generasi z di dki jakarta
Analisis Faktor yang Memengaruhi Perilaku Penggunaan Aplikasi GoPay: Transfer & Payment Mempergunakan Model Unified Theory Of Acceptance And Use Of Technology (UTAUT),"Moh Nabil Maula Rhois, Aditya  Rachmadi, Satrio  Hadi Wijoyo",analisis faktor yang memengaruhi perilaku penggunaan aplikasi gopay transfer   payment mempergunakan model unify theory acceptance use technology utaut
Analisis Faktor yang Mempengaruhi Tingkat Penerimaan Teknologi pada Pengguna Aplikasi Notion Menggunakan Technology Acceptance Model (TAM) Termodifikasi,"Naira Ghassaani, Intan Sartika Eris Maghfiroh, Mochamad Chandra Saputra",analisis faktor yang mempengaruhi tingkat penerimaan teknologi pada pengguna aplikasi notion menggunakan technology acceptance model tam termodifikasi
Analisis Faktor – Faktor yang Memengaruhi Keputusan Generasi Z Menggunakan Aplikasi Threads,"Attarik Ramadhan Abdullah, Intan Sartika  Eris, Aryo Pinandito",analisis faktor – faktor yang memengaruhi keputusan generasi z menggunakan aplikasi thread
Analisis Faktor-Faktor Yang Memengaruhi Intention to Subscribe Dalam Menggunakan Layanan Streaming Over-the-Top Vidio (Studi Kasus: Fakultas Ilmu Komputer Universitas Brawijaya),"danny liunardo, Aryo Pinandito, Himawat Aryadita",analisis faktorfaktor yang memengaruhi intention subscribe dalam menggunakan layanan streaming overthetop vidio studi kasus fakulta ilmu komputer universitas brawijaya
Analisis Faktor-Faktor Yang Memengaruhi Keputusan Siswa Jurusan TKJ SMKN 2 Malang dalam Melanjutkan Pendidikan Atau Kerja Industri,"Nowwil Afqa, Retno Indah Rokhmawati, Khalid Rahman",analisis faktorfaktor yang memengaruhi keputusan siswa jurusan tkj smkn 2 malang dalam melanjutkan pendidikan atau kerja industri
Analisis Faktor-Faktor Yang Memengaruhi Penerimaan Aplikasi Threads (Studi Kasus: Generasi Milenial Dan Generasi Z),"Khalish Muhammad Fattah, Buce Trias Hanggara, Himawat Aryadita",analisis faktorfaktor yang memengaruhi penerimaan aplikasi thread studi kasus generasi milenial dan generasi z
Analisis Faktor-Faktor Yang Mempengaruhi Intention To Use Pada Aplikasi Tokopedia Menggunakan Technology Acceptance Model (TAM) Termodifikasi,"Hasna Aulia Rahma Zudiah, Yusi Tyroni Mursityo, Dwi Cahya Astriya Nugraha",analisis faktorfaktor yang mempengaruhi intention use pada aplikasi tokopedia menggunakan technology acceptance model tam termodifikasi
Analisis Faktor-Faktor yang Berdampak terhadap Minat Adopsi Penggunaan Aplikasi BRImo,"Adam Ghirvan Fadhil, Intan Sartika Eris Maghfiroh, Nanang Yudi Setiawan",analisis faktorfaktor yang berdampak terhadap minat adopsi penggunaan aplikasi brimo
Analisis Faktor-Faktor yang Berpengaruh Terhadap Kepuasan Pengguna Aplikasi Livin by Mandiri Menggunakan Metode EUCS (Studi Kasus Mahasiswa di DKI Jakarta),"Reynaldi Holtrop, Satrio Hadi Wijoyo, Dwi Cahya Astriya Nugraha",analisis faktorfaktor yang berpengaruh terhadap kepuasan pengguna aplikasi livin mandiri menggunakan metode eucs studi kasus mahasiswa di dki jakarta
Analisis Faktor-Faktor yang Memengaruhi Continuance Intention terhadap Penggunaan Aplikasi Access by KAI (Studi Kasus: Mahasiswa Fakultas Ilmu Komputer Universitas Brawijaya),"Steven Rahardjo, Aryo Pinandito, Wibisono Sukmo Wardhono",analisis faktorfaktor yang memengaruhi continuance intention terhadap penggunaan aplikasi access kai studi kasus mahasiswa fakulta ilmu komputer universitas brawijaya
Analisis Faktor-Faktor yang Memengaruhi Intention To Use Dan Actual Usage dalam Penggunaan Aplikasi Beam di Lingkungan Universitas Brawijaya,"Hidayat Mukti Wibowo, Intan Sartika Eris Maghfiroh, Retno Indah  Rokhmawati",analisis faktorfaktor yang memengaruhi intention use dan actual usage dalam penggunaan aplikasi beam di lingkungan universitas brawijaya
Analisis Faktor-Faktor yang Memengaruhi Kepuasan Pengguna Aplikasi Gramedia Digital,"Odilia Ning Intan Restu Hapsari, Hanifah Muslimah Az-zahra, Ismiarta Aknuranda",analisis faktorfaktor yang memengaruhi kepuasan pengguna aplikasi gramedia digital
Analisis Faktor-Faktor yang Memengaruhi Kualitas Learning Management System Pada Platform Pembelajaran dan Persiapan Karier Digital,"Bintang, Aryo Pinandito, Mochamad Chandra Saputra",analisis faktorfaktor yang memengaruhi kualitas learn management system pada platform pembelajaran dan persiapan karier digital
Analisis Faktor-Faktor yang Memengaruhi Niat Penggunaan dalam Penerimaan Aplikasi Layanan Kerja di Stasiun Televisi Milik Negara,"Ratu Salma  Al Khairiyah, Aryo Pinandito, Intan Sartika Eris Maghfiroh",analisis faktorfaktor yang memengaruhi niat penggunaan dalam penerimaan aplikasi layanan kerja di stasiun televisi milik negara
Analisis Faktor-Faktor yang Memengaruhi Search Engine Result Page (SERP) Menggunakan Metode SEO On-Page dan Off-Page (Studi Kasus: Situs Ulasan CBD Oil Australia),"Audrey Axel Ristyanto, Satria Hadi Wijoyo, Widhy Hayuhardhika Nugraha Putra",analisis faktorfaktor yang memengaruhi search engine result page serp menggunakan metode seo onpage dan offpage studi kasus situs ulasan cbd oil australia
Analisis Faktor-Faktor yang Memengaruhi Terhadap Minat Penggunaan Aplikasi Online Grocery Shopping Alfagift Terintegrasi Pembayaran Digital,"Ivana C. Rutchya, Satrio Hadi Wijoyo, Widhy Hayuhardhika Nugraha Putra",analisis faktorfaktor yang memengaruhi terhadap minat penggunaan aplikasi online grocery shopping alfagift terintegrasi pembayaran digital
Analisis Faktor-Faktor yang Mempengaruhi Kepuasan Pengguna Aplikasi Gapura UB,"Isna Bella Fajrina Anwar, Aryo Pinandito, Dwi Cahya Astriya Nugraha",analisis faktorfaktor yang mempengaruhi kepuasan pengguna aplikasi gapura ub
Analisis Faktor-Faktor yang Mempengaruhi Kepuasan Pengguna Sistem Informasi Manajemen Pendidikan di Tingkat Perguruan Tinggi,"Kenneth Clinton Waworuntu, Aryo Pinandito, Satrio Hadi Wijoyo",analisis faktorfaktor yang mempengaruhi kepuasan pengguna sistem informasi manajemen pendidikan di tingkat perguruan tinggi
Analisis Faktor-Faktor yang Mempengaruhi Kesuksesan Fitur Mobile Order Pada Aplikasi Starbucks Indonesia Berdasarkan Perspektif Pengguna Menggunakan Model Kesuksesan Delone dan McLean,"Davala Safa, Intan Sartika Eris Maghfiroh, Himawat Aryadita, Davala Safa, Intan Sartika Eris Maghfiroh, Himawat Aryadita",analisis faktorfaktor yang mempengaruhi kesuksesan fitur mobile order pada aplikasi starbuck indonesia berdasarkan perspektif pengguna menggunakan model kesuksesan delone dan mclean
Analisis Faktor-Faktor yang Mempengaruhi Minat Beli Recommerce (Studi Kualitatif Jual Beli Pakaian Bekas di Aplikasi Carousell),"Dara Nurul Idlal  Linuwih, Aditya Rachmadi, Admaja Dwi Herlambang",analisis faktorfaktor yang mempengaruhi minat beli recommerce studi kualitatif jual beli pakaian bekas di aplikasi carousell
Analisis Faktor-Faktor yang Mempengaruhi Niat Penggunaan Quick Response Code Indonesian Standard (QRIS) Pada Pelaku UMKM Kuliner di Kota Malang,"Helga Juan, Satrio, Intan",analisis faktorfaktor yang mempengaruhi niat penggunaan quick response code indonesian standard qris pada pelaku umkm kuliner di kota malang
Analisis Faktor-Faktor yang Mempengaruhi Penerimaan Meterai Elektronik pada Mahasiswa Universitas Brawijaya Menggunakan TAM Termodifikasi,"Muhammad Irvan Hanif, Yusi Tyroni Mursityo, Dwi Cahya Astriya Nugraha",analisis faktorfaktor yang mempengaruhi penerimaan meterai elektronik pada mahasiswa universitas brawijaya menggunakan tam termodifikasi
Analisis Faktor-Faktor yang Mempengaruhi Prestasi Belajar Siswa Kelas 11 Rekayasa Perangkat Lunak pada Mata Pelajaran Basis Data di SMK National Media Center Malang,"Panji Aris Setyawan, Satrio Hadi Wijoyo, Faizatul Amalia",analisis faktorfaktor yang mempengaruhi prestasi belajar siswa kelas 11 rekayasa perangkat lunak pada mata pelajaran basis datum di smk national media center malang
Analisis Faktor-faktor yang Memengaruhi Minat Penggunaan Ulang Mahasiswa pada Platform E-Learning dan Bootcamp IT,"Ilham Nuansa Shaylendra Putra Pamungkas, Aryo Pinandito, Retno Indah Rokhmawati",analisis faktorfaktor yang memengaruhi minat penggunaan ulang mahasiswa pada platform elearning dan bootcamp
Analisis Forensik Digital untuk Investigasi Kasus Cyberbullying pada Media Sosial TikTok,"Halimah Septya Mikayla, Ari Kusyanti, Primantara Hari Trisnawan",analisis forensik digital untuk investigasi kasus cyberbullye pada medium sosial tiktok
Analisis Geospasial Perubahan Penggunaan Lahan Sawah Di Kota Malang Menggunakan Google Earth Engine,"Renaldy Hermawan, Alfi Nur Rusydi, Muhammad Aminul Akbar",analisis geospasial perubahan penggunaan lahan sawah di kota malang menggunakan google earth engine
Analisis Hubungan Kualitas Layanan Aplikasi Binar Academy Berdasarkan E-S-Qual Dan E-Recs-Qual Dengan Kepuasan Pelanggan,"Muhammad Imaduddien Abdurrahim, Andi Reza Perdanakusuma, Satrio Hadi Wijoyo",analisis hubungan kualita layanan aplikasi binar academy berdasarkan esqual dan erecsqual dengan kepuasan pelanggan
Analisis Implementasi Animasi UI XML dan Jetpack Compose pada Aplikasi Android Menggunakan Bahasa Pemrograman Kotlin,"Rheza Firmandha, Muhammad Aminul Akbar, Aryo Pinandito",analisis implementasi animasi ui xml dan jetpack compose pada aplikasi android menggunakan bahasa pemrograman kotlin
Analisis Intention to Use pada Metode Pembayaran Cash on Delivery (COD) di E-commerce Shopee menggunakan Technology Acceptance Model (TAM),"Via Salsabila Rahmadhani, Yusi Tyroni Mursityo, Intan Sartika Eris Maghfiroh",analisis intention use pada metode pembayaran cash delivery cod di ecommerce shopee menggunakan technology acceptance model tam
Analisis Karakteristik Pelanggan Menggunakan Metode RFM-DL dan Algoritma DBSCAN,"Rhobith, Fitra, Budi",analisis karakteristik pelanggan menggunakan metode rfmdl dan algoritma dbscan
Analisis Karakteristik Transmisi LORA dalam Ruangan,"Haidar Harfi  Hadhiansah, Kasyful  Amron, Reza Andria  Siregar",analisis karakteristik transmisi lora dalam ruangan
Analisis Kebutuhan Pengguna pada LMS (Learning Management System) Eling FILKOM UB menggunakan Metode Fuzzy Kano,"Tsabita Dwina Putri, Yusi Tyroni Mursityo, Dwi Cahya Astriya Nugraha",analisis kebutuhan pengguna pada lms learn management system ele filkom ub menggunakan metode fuzzy kano
Analisis Kepuasan Mahasiswa terhadap Penggunaan Aplikasi Transportasi Online,"Hasna Azlya, Aryo Pinandito, Dwi Cahya Astriya Nugraha",analisis kepuasan mahasiswa terhadap penggunaan aplikasi transportasi online
Analisis Kepuasan Pengguna Aplikasi PeduliLindungi menggunakan User Satisfaction Model MGov,"Mohammad Aditya Putra, Fajar Pradana, Mochamad Chandra Saputra",analisis kepuasan pengguna aplikasi pedulilindungi menggunakan user satisfaction model mgov
Analisis Kepuasan Pengguna IM3 Terhadap Aplikasi MyIM3 Menggunakan Metode End User Computing Satisfaction (EUCS) Termodifikasi,"Cahya Sari, Aditya  Rachmadi, Admaja  Dwi Herlambang",analisis kepuasan pengguna im3 terhadap aplikasi myim3 menggunakan metode end user computing satisfaction eucs termodifikasi
Analisis Kepuasan Pengguna LMS Online Bootcamp dengan Metode End User Computing Satisfaction (EUCS) dan Importance Performance Analysis (IPA) (Studi Kasus: Online Bootcamp XYZ),"Sarah Uli Octavia, Satrio Hadi Wijoyo, Almira Syawli",analisis kepuasan pengguna lms online bootcamp dengan metode end user computing satisfaction eucs dan importance performance analysis ipa studi kasus online bootcamp xyz
Analisis Kesediaan User Permission pada Fitur App Tracking Transparency melalui pendekatan Protection Motivation Theory,"Faidatul Syafiqah, Aryo Pinandoto, Retno  Indah Rokhmawati",analisis kesediaan user permission pada fitur app tracking transparency melalui pendekatan protection motivation theory
Analisis Kesuksesan Aplikasi JConnect Mobile Menggunakan Model DeLone and McLean,"Alvino Dwiky Atmaja, Aditya  Rachmadi, Satrio Hadi  Wijoyo",analisis kesuksesan aplikasi jconnect mobile menggunakan model delone mclean
Analisis Kesuksesan Implementasi Pembayaran Digital pada E-Commerce Tanaman Hias menggunakan Model DeLone dan McLean: Kasus Isitaman,"Muhammad Daffa Rafi  Ramadhani, Ismiarta  Aknuranda, Buce Trias Hanggara",analisis kesuksesan implementasi pembayaran digital pada ecommerce tanaman hia menggunakan model delone dan mclean kasus isitaman
Analisis Kesuksesan Implementasi Rekam Medis Elektronik (RME) Pada Klinik Pratama Menggunakan Model Human Organisation Technology-Fit,"Aurellia Ristivani Aisha Fitri, Suprapto, Ismiarta Aknuranda",analisis kesuksesan implementasi rekam medis elektronik rme pada klinik pratama menggunakan model human organisation technologyfit
Analisis Kesuksesan Penggunaan Layanan BSI Mobile Menggunakan DeLone & McLean Model,"Uzlifatul Izzah, Riswan Septriayadi Sianturi, Dwi Cahya Astriya Nugraha",analisis kesuksesan penggunaan layanan bsi mobile menggunakan delone   mclean model
Analisis Kesuksesan Sistem Informasi Manajemen Amazing Report Media Integration (ARMI) Pada CV Skipperwebs Dengan Model Delone & Mclean Termodifikasi,"Dewi Ayu Alamanda Purnama, Intan Sartika Eris Maghfiroh, Mochamad Chandra Saputra",analisis kesuksesan sistem informasi manajeman amazing report medium integration armi pada cv skipperwebs dengan model delone   mclean termodifikasi
Analisis Ketahanan Routing Protocol Open Shortest Path First (OSPF) terhadap Serangan Route Injection,"Satria Adi  Tama, Mahendra Data, Fariz Andri Bakhtiar",analisis ketahanan route protocol open short path ospf terhadap serangan route injection
Analisis Kinerja Autentikasi Berbasis Behavioral Biometrics Menggunakan Algoritma Decision Tree dan Differential Privacy,"Ruri Desfianti, M. Ali Fauzi, Mahendra Data",analisis kinerja autentikasi berbasis behavioral biometric menggunakan algoritma decision tree dan differential privacy
Analisis Kinerja Jaringan 5G Telkomsel pada Kawasan Transit Oriented Development (TOD) Dukuh Atas,"Muhammad Nadhif Nabhan, Hariz Farisi, Uun Hariyanti",analisis kinerja jaringan 5 g telkomsel pada kawasan transit orient development tod dukuh ata
Analisis Kinerja Mekanisme Caching MongoDB Cluster pada Moodle,Ilham Fathur Ilmi,analisis kinerja mekanisme cache mongodb cluster pada moodle
Analisis Kinerja Mekanisme Caching Redis pada Moodle,Asrorul Hidayatut Tya Harianto,analisis kinerja mekanisme cache redis pada moodle
"Analisis Kinerja Protokol Routing AODV, DSR, DSDV, dan FSR pada VANET","Dwi Priyanto, Sabriansyah Rizqika Akbar",analisis kinerja protokol routing aodv dsr dsdv dan fsr pada vanet
"Analisis Kinerja Routing Protokol Open Shortest Path First (OSPF), Intermediate System to Intermediate System (IS-IS) dan Enhanced Interior Gateaway Routing Protocol (EIGRP) Pada Jaringan IPV6",Muhammad Ali Aras Ramadhan,analisis kinerja route protokol open short path ospf intermediate system intermediate system isis dan enhance interior gateaway route protocol eigrp pada jaringan ipv6
Analisis Kinerja Support Vector Machine dan Naïve Bayes Classifier Pada Data Komentar Kualitas Mengajar Dosen (Studi Kasus: Pendidikan Teknologi Informasi Universitas Brawijaya),"raflyy zidny, Hadi, Agung",analisis kinerja support vector machine dan naïve bayes classifier pada data komentar kualitas mengajar dosen studi kasus pendidikan teknologi informasi universitas brawijaya
Analisis Klasifikasi Spam Email Menggunakan Metode Extreme Gradient Boosting (XGBoost),"Lintang Gladyza Adinda Putri, Satrio A.  Wicaksono, Bayu Rahayudi",analisis klasifikasi spam email menggunakan metode extreme gradient boost xgboost
Analisis Klasifikasi Waktu Tunggu Kerja Lulusan dengan Support Vector Machine pada Data Tracer Study (Studi Kasus: Lulusan 2015-2020 Fakultas Ilmu Komputer Universitas Brawijaya),"zubaidah diniyah, Nanang Yudi  Setiawan, Dian Eka Ratnawati",analisis klasifikasi waktu tunggu kerja lulusan dengan support vector machine pada datum tracer study studi kasus lulusan 20152020 fakulta ilmu komputer universitas brawijaya
Analisis Komparasi Algoritme C4.5 dan Naïve Bayes dalam Kasus Klasifikasi Kecenderungan Gaya Belajar Visual Auditori Kinestetik (VAK),"Alvindo Tri Jatmiko, Wibisono Sukmo Wardhono, Satrio Hadi Wijoyo",analisis komparasi algoritme c45 dan naïve bayes dalam kasus klasifikasi kecenderungan gaya belajar visual auditori kinestetik vak
Analisis Komparatif Kinerja Library WebSocket dalam Bahasa Pemrograman Go,"Bagas Hizbullah, Djoko Pramono, Aryo Pinandito",analisis komparatif kinerja library websocket dalam bahasa pemrograman
Analisis Kualitas Aplikasi Berdasarkan Ulasan Pengguna Menggunakan Quality in Use Pada Karakteristik Satisfaction dan Freedom from Risk (Studi kasus: Aplikasi Pembelajaran Sololearn),"Muhammad Ikhlasul Amal, Mochamad Chandra Saputra, Nanang Yudi Setiawan",analisis kualita aplikasi berdasarkan ulasan pengguna menggunakan quality use pada karakteristik satisfaction dan freedom risk studi kasus aplikasi pembelajaran sololearn
Analisis Kualitas Aplikasi Menggunakan Karakteristik Quality In Use Satisfaction dan Efficiency Berdasarkan Ulasan Pengguna (Studi Kasus Aplikasi Pembelajaran: Khan Academy),"Prasetya Naufal Rahmandita, Mochamad Chandra  Saputra, Nanang Yudi  Setiawan",analisis kualita aplikasi menggunakan karakteristik quality use satisfaction dan efficiency berdasarkan ulasan pengguna studi kasus aplikasi pembelajaran khan academy
Analisis Kualitas Layanan Website Brawijaya Online Learning (BRONE) Menggunakan Metode Webqual 4.0 Dan Importance-Performance Analysis,"Muhammad Hanif Ardhiansyah, Dian Eka Ratnawati, Retno Indah Rokhmawati",analisis kualita layanan website brawijaya online learning brone menggunakan metode webqual 40 dan importanceperformance analysis
Analisis Kualitas Layanan Website Cove Terhadap Kepuasan Pelanggan dengan Menggunakan Metode Webqual 4.0,"Sari Rahmawati, Intan Sartika Eris Maghfiroh, Buce Trias Hanggara",analisis kualita layanan website cove terhadap kepuasan pelanggan dengan menggunakan metode webqual 40
Analisis Kualitas Situs Dribbble.com Menggunakan Metode WebQual 4.0 dan Importance Performance Analysis (IPA),"Elvaretta Rizky Laverda, Intan Sartika Eris  Maghfiroh, Buce Trias Hanggara",analisis kualita situs dribbblecom menggunakan metode webqual 40 dan importance performance analysis ipa
Analisis Kualitas Situs Jobseeker Glints Dengan Metode WebQual 4.0 dan Importance-Performance Analysis (IPA),"Indira Setia Kamila, Intan Sartika Eris Maghfiroh, Buce Trias Hanggara",analisis kualita situs jobseeker glint dengan metode webqual 40 dan importanceperformance analysis ipa
Analisis Kualitas Website Brone Menggunakan Webqual 4.0 dan Importance-Performance Analysis (IPA) (Studi Kasus: Mahasiswa Fakultas Ilmu Komputer Universitas Brawijaya),"Danuarta Dwi Yuli Saputro, Aditya Rachmadi, Satrio Hadi Wijoyo",analisis kualita website brone menggunakan webqual 40 dan importanceperformance analysis ipa studi kasus mahasiswa fakulta ilmu komputer universitas brawijaya
Analisis Kualitas Website E-Learning Universitas Islam Bandung (E-Kuliah) Menggunakan Metode WebQual 4.0 dan Importance Performance Analysis (IPA),"Syahda Rani Salsabila, Satrio Hadi Wijoyo, Dwi Cahya Astriya Nugraha",analisis kualita website elearning universitas islam bandung ekuliah menggunakan metode webqual 40 dan importance performance analysis ipa
Analisis Kualitas Website E-commerce terhadap Kepuasan Pengguna dengan Metode WebQual 4.0 dan Importance-Performance Analysis (Studi Kasus: Lullaby Luxury LLC),Anindya Shafa,analisis kualita website ecommerce terhadap kepuasan pengguna dengan metode webqual 40 dan importanceperformance analysis studi kasus lullaby luxury llc
Analisis Kualitas Website Evira Terhadap Kepuasan Pengguna Menggunakan Metode WebQual 4.0,"Bunga Sauma Faturani, Satrio Hadi Wijoyo, Aditya Rachmadi",analisis kualita website evira terhadap kepuasan pengguna menggunakan metode webqual 40
Analisis Kualitas Website Portal Berita Merdeka.com Menggunakan Metode Webqual 4.0,"Jihan Qurrotul 'Aini, Intan Sartika Eris Maghfiroh, Andi Reza Perdanakusuma",analisis kualita website portal berita merdekacom menggunakan metode webqual 40
Analisis Kualitas Website SMP Negeri 21 Malang Menggunakan Metode WebQual 4.0 dan Importance Performance Analysis (IPA),"Ayunizar Fata Ardelia, Satrio Hadi Wijoyo, Dwi Cahya Astriya Nugraha",analisis kualita website smp negeri 21 malang menggunakan metode webqual 40 dan importance performance analysis ipa
