title,penulis,cleaned_title
Penerapan Metode Moving Average dan Exponential Smoothing pada Peramalan Indeks Pembangunan Manusia di Provinsi Papua Pegunungan,"M. Sabran Fauzan, Indriati, Edy Santoso",penerapan metode move average dan exponential smooth pada peramalan indeks pembangunan manusia di provinsi papua pegunungan
Penerapan Metode Naive Bayes dalam Sistem Pendeteksi Kualitas Tanah pada Tanaman Kedelai,"Johannes Riski  Sitinjak, Mochammad Hannats Hanafi Ichsan, Eko Setiawan",penerapan metode naive baye dalam sistem pendeteksi kualitas tanah pada tanaman kedelai
Penerapan Metode Support Vector Machine Untuk  Klasifikasi Air Minum Isi Ulang (AMIU) Layak Minum Berbasis Arduino,"Ilham Ichsani Trisna, Eko Setiawan",penerapan metode support vector machine untuk   klasifikasi air minum isi ulang amiu layak minum berbasis arduino
Penerapan Model Discovery Learning Berbantu Media Audio-Visual Terhadap Hasil Belajar Siswa pada Mata Pelajaran Pemrograman Dasar Di Smk Negeri 3 Malang,"Adellia Putri Puspitasari, Admaja Dwi  Herlambang, Prima Zulvarina",penerapan model discovery learning berbantu medium audiovisual terhadap hasil belajar siswa pada mata pelajaran pemrograman dasar di smk negeri 3 malang
Penerapan Model Whisper Pada Embedded System untuk Speech To Text,"Ahmad Dhani Wafiy, Barlian  Henryranu Prasetio",penerapan model whisper pada embed system untuk speech text
Penerapan Modul Ghost dan SimAM pada Sistem Guide Following Kursi Roda Pintar Berbasis YOLOv8N,"Asma Kamilah Nur Jawahir, Fitri Utaminingrum",penerapan modul ghost dan simam pada sistem guide follow kursi roda pintar berbasis yolov8n
Penerapan Optimisasi Pruning dan Clustering Tensorflow Lite Pada Embedded System untuk Sistem Speech To Text,Aloysius Darin Ario,penerapan optimisasi prune dan clustering tensorflow lite pada embed system untuk sistem speech text
Penerapan Pemodelan Topik Komentar Melalui Media Sosial Twitter Menggunakan Latent Dirichlet Allocation (Studi Kasus: Pemerintah Kota Malang),Zainiyah Nafiatul Muna,penerapan pemodelan topik komentar melalui media sosial twitter menggunakan latent dirichlet allocation studi kasus pemerintah kota malang
Penerapan Pemodelan Topik menggunakan Metode Latent Dirichlet Allocation terhadap Pembehasan Pemilu Indonesia tahun 2024 di Twitter,Alya Fitri Nurhaliza,penerapan pemodelan topik menggunakan metode latent dirichlet allocation terhadap pembehasan pemilu indonesia tahun 2024 di twitter
Penerapan Prinsip Aesthetic-Usability Effect untuk Mengukur Tingkat Usability pada Aplikasi M-Banking BCA Mobile Menggunakan Usability Testing,"Elok Nuraida Kusuma Dewi, Agi Putra Kharisma, Muhammad Arif Rahman",penerapan prinsip aestheticusability effect untuk mengukur tingkat usability pada aplikasi mbanke bca mobile menggunakan usability testing
Penerapan Progressive Disclosure dan Hierarki pada Aplikasi M.Tix untuk Meningkatkan Usability,"Safinatunnajah Mutiara Putri, Agi Putra Kharisma, Muh. Arif Rahman",penerapan progressive disclosure dan hierarki pada aplikasi mtix untuk meningkatkan usability
Penerapan Short Time Fourier Transform Pada Koefisien Cepstral Mel untuk Menghitung Jumlah Pembicara,"Abdul Harris Prawironegoro, Barlian Henryranu Prasetio",penerapan short time fouri transform pada koefisien cepstral mel untuk menghitung jumlah pembicara
Penerapan Short Time Fourier Transform pada MFCC untuk Sistem Pengenalan Ucapan Tingkat Stres,"Haidar Rheza  Paleva, Barlian Henryranu  Prasetio",penerapan short time fouri transform pada mfcc untuk sistem pengenalan ucapan tingkat stre
Penerapan Transformasi Fractional Pada Representasi Fitur Mel Frequency Cepstral  Coefficients (MFCC) untuk Mendeteksi Tingkat Emosi Disgust,"Aryanta Seta Mahardika, Barlian Henryranu Prasetio",penerapan transformasi fractional pada representasi fitur mel frequency cepstral   coefficient mfcc untuk mendeteksi tingkat emosi disgust
Penerapan Transformasi STFT (Short Time Fourier Transform) pada Koefisien Frekuensi Mel untuk Mengenali Tipe Vokal Suara,"Attar Syifa Kamal, Barlian Henryranu Prasetio",penerapan transformasi stft short time fouri transform pada koefisien frekuensi mel untuk mengenali tipe vokal suara
Penerapan Transformasi Wavelet pada Koefisien Cepstral Mel untuk Mengenali Stress Pembicara,"Zidane Ali, Barlian Henryranu Prasetio",penerapan transformasi wavelet pada koefisien cepstral mel untuk mengenali stress pembicara
Penerapan Wavelet Transform pada Sinyal Ultrasound untuk Analisis Kesehatan Bibit Tanaman Sawit,"Muhammad Alif Nur Abiyyu, Barlian Henryranu Prasetio",penerapan wavelet transform pada sinyal ultrasound untuk analisis kesehatan bibit tanaman sawit
Penerapan Websocket pada Sistem Live Chat berbasis Web (Studi Kasus Website Kwikku.com),"Lius Alviando, Adhitya Bhawiyuga, Dany Primanita Kartikasari",penerapan websocket pada sistem live chat berbasis web studi kasus website kwikkucom
Pengaruh Adopsi E-commerce dan E-payment terhadap Kinerja UMKM di Kelurahan Penanggungan,"Simon Bukama, Buce Trias  Hanggara, Almira Syawli",pengaruh adopsi ecommerce dan epayment terhadap kinerja umkm di kelurahan penanggungan
Pengaruh Algoritma Konsensus Raft dan Smart-BFT dalam Teknologi Blockchain dengan Platform Hyperledger Fabric pada Lingkungan Multi-VM,"Anthony Aaron, Dany Primanita Kartikasari, Nur Hazbiy Shaffan",pengaruh algoritma konsensus raft dan smartbft dalam teknologi blockchain dengan platform hyperledger fabric pada lingkungan multivm
Pengaruh Atribut Key Opinion Leader (KOL) pada Media Sosial Instagram terhadap Minat Beli Konsumen pada Bootcamp Online,"Sofi Shahira Khoirunnisa, Aryo  Pinandito",pengaruh atribut key opinion leader kol pada medium sosial instagram terhadap minat beli konsumen pada bootcamp online
Pengaruh Bootcamp Online terhadap Kesiapan Kerja Mahasiswa,"Huriyah Anisah Nur Humairoh, Aryo Pinandito",pengaruh bootcamp online terhadap kesiapan kerja mahasiswa
Pengaruh Faktor-Faktor Internal dan Eksternal Terhadap Keputusan Bekerja pada Peserta Didik Rumpun TI di SMKN 4 Malang,"Imam Suprayogo, Wibisono Sukmo  Wardhono, Prima Zulvarina",pengaruh faktorfaktor internal dan eksternal terhadap keputusan bekerja pada peserta didik rumpun ti di smkn 4 malang
Pengaruh Fitur Auto-battle terhadap Retensi Pemain dalam Game Mobile RPG Anime: Studi Kasus pada Komunitas Arknights dan Blue Archive,"Muhammad Nuril Haq, Bayu Rahayudi, Achmad Ridok",pengaruh fitur autobattle terhadap retensi pemain dalam game mobile rpg anime studi kasus pada komunitas arknights dan blue archive
Pengaruh Game-Based Learning Terhadap Motivasi Dan Hasil Belajar Peserta didik Pada Mata Kuliah Pemrograman Dasar,"Dwi Anggraeni, Admaja Dwi  Herlambang, Tri Afirianto",pengaruh gamebase learn terhadap motivasi dan hasil belajar peserta didik pada mata kuliah pemrograman dasar
Pengaruh Golongan Usia Pengguna dari Layanan Ride-Hailing terhadap Faktor-Faktor Penggunaan Teknologi berdasarkan Unified Theory of Acceptance and Use of Technology,"Melin Febriani, Aditya Rachmadi, Admaja Dwi Herlambang",pengaruh golongan usia pengguna dari layanan ridehaile terhadap faktorfaktor penggunaan teknologi berdasarkan unify theory acceptance use technology
Pengaruh Implementasi Flipped Classroom Berbasis Google Sites Terhadap Hasil Belajar Siswa pada Mata Pelajaran Dasar Program Keahlian (Studi Kasus: SMK Negeri 12 Malang),"Azhar Salsabila Naqiyah, Admaja Dwi Herlambang, Faizatul Amalia",pengaruh implementasi flip classroom berbasis google site terhadap hasil belajar siswa pada mata pelajaran dasar program keahlian studi kasus smk negeri 12 malang
Pengaruh Implementasi Flipped Classroom Terhadap Self-Regulated Learning dan Hasil Belajar pada Mata Pelajaran Web Content,"Failashofi Nabila, Admaja Dwi Herlambang, Uun Hariyanti",pengaruh implementasi flip classroom terhadap selfregulate learn dan hasil belajar pada mata pelajaran web content
Pengaruh Implementasi Flowgorithm Terhadap Hasil Belajar Peserta Didik SMA Negeri 3 Malang Pada Mata Pelajaran Informatika Menggunakan Model Pembelajaran Problem Based Learning,"Wulan Della Elfarin, Prima Zulvarina, Faizatul Amalia",pengaruh implementasi flowgorithm terhadap hasil belajar peserta didik sma negeri 3 malang pada mata pelajaran informatika menggunakan model pembelajaran problem base learn
Pengaruh Implementasi Metode Pembelajaran Peta Konsep terhadap Hasil Belajar Siswa pada Mata Pelajaran Dasar-Dasar Desain Komunikasi Visual di SMKN 7 Malang,"Vika Wahyuni  Apriliyanti, Admaja Dwi Herlambang, Prima Zulvarina",pengaruh implementasi metode pembelajaran peta konsep terhadap hasil belajar siswa pada mata pelajaran dasardasar desain komunikasi visual di smkn 7 malang
Pengaruh Implementasi Model Pembelajaran Project Based Learning terhadap Hasil Belajar Siswa pada Mata Pelajaran Komputer dan Jaringan Dasar di SMK Negeri 6 Malang,"Nastiti Wijayanti, Admaja Dwi Herlambang, Prima Zulfarina",pengaruh implementasi model pembelajaran project base learn terhadap hasil belajar siswa pada mata pelajaran komputer dan jaringan dasar di smk negeri 6 malang
Pengaruh Implementasi Model Problem-Based Learning Berbantuan GitHub dan ChatGPT Terhadap Hasil Belajar dan Kemampuan Abstraksi,"Ajeng Ayu Kusuma Wardani, Admaja Dwi Herlambang, Aditya Rachmadi",pengaruh implementasi model problembase learn berbantuan github dan chatgpt terhadap hasil belajar dan kemampuan abstraksi
Pengaruh Implementasi Model Problem-Based Learning Berbantuan GitHub dan ChatGPT terhadap Hasil Belajar dan Kreativitas Pemrograman,"Faishal Fariz Hidayatullah, Admaja Dwi Herlambang, Tri Afirianto",pengaruh implementasi model problembase learn berbantuan github dan chatgpt terhadap hasil belajar dan kreativitas pemrograman
Pengaruh Implementasi Penggunaan Media Pembelajaran Gitpod pada Model Problem Based Learning dalam Mata Pelajaran Informatika Terhadap Hasil Belajar Siswa SMAN 3 Malang,"Nadha Fitri, Prima Zulvarina, Admaja Dwi Herlambang",pengaruh implementasi penggunaan media pembelajaran gitpod pada model problem base learn dalam mata pelajaran informatika terhadap hasil belajar siswa sman 3 malang
Pengaruh Implementasi Problem-Based Learning Berbantuan GitHub dan ChatGPT Terhadap Hasil Belajar dan Kemampuan Kolaborasi,"Resty Cahyani Pradita, Admaja Dwi Herlambang, Tri  Afirianto",pengaruh implementasi problembase learn berbantuan github dan chatgpt terhadap hasil belajar dan kemampuan kolaborasi
Pengaruh Implementasi Problem-Based Learning Berbantuan GitHub dan ChatGPT Terhadap Hasil Belajar dan Kemampuan Logika Pemrograman,"Gabriella Fadhilatus Awanda, Admaja Dwi Herlambang, Aditya Rachmadi",pengaruh implementasi problembase learn berbantuan github dan chatgpt terhadap hasil belajar dan kemampuan logika pemrograman
Pengaruh Implementasi Problem-Based Learning Berbantuan Sumber  Belajar Digital pada Mata Pelajaran Instalasi Perangkat Jaringan,"Yanuarin Salwa Afranita, Admaja Dwi Herlambang, Uun Hariyanti",pengaruh implementasi problembase learn berbantuan sumber   belajar digital pada mata pelajaran instalasi perangkat jaringan
Pengaruh Implementasi Problem-Based Learning dengan Variasi Skenario Screen Time terhadap Hasil dan Minat Belajar,"Kumara Sahasika  Laksmana, Admaja Dwi  Herlambang, Uun Hariyanti",pengaruh implementasi problembase learn dengan variasi skenario screen time terhadap hasil dan minat belajar
Pengaruh Implementasi Problem-based Learning berbantuan ChatGPT dan Github terhadap Hasil Belajar dan Kemampuan Pemecahan Masalah,"Salvia Dyah Kurniasari, Admaja Dwi Herlambang, Satrio Hadi Wijoyo",pengaruh implementasi problembase learn berbantuan chatgpt dan github terhadap hasil belajar dan kemampuan pemecahan masalah
Pengaruh Implementasi Unsur Desain Grafis pada Media Pembelajaran berbasis Presentasi dalam Mata Pelajaran Pemrograman Dasar terhadap Motivasi Belajar Siswa SMK,"Muhammad Isnainanda Andriyanto, Admaja Dwi Herlambang, Khalid Rahman",pengaruh implementasi unsur desain grafis pada medium pembelajaran berbasis presentasi dalam mata pelajaran pemrograman dasar terhadap motivasi belajar siswa smk
Pengaruh Information Communication Technology (ICT) Pada Energi Terbarukan Mnggunakan GRU dan Ridge Regression,Yvette Celia Aviani,pengaruh information communication technology ict pada energi terbarukan mnggunakan gru dan ridge regression
Pengaruh Information Overload pada LinkedIn terhadap Perilaku Penghentian Penggunaan,"Pramesti Giasasmita Mellyana, Aryo  Pinandito",pengaruh information overload pada linkedin terhadap perilaku penghentian penggunaan
"Pengaruh Kesiapan Sekolah, Kesiapan Instruktur, Serta Penggunaan Django Framework Dan Bootstrap 5 Dalam Pelaksanaan Teaching Factory Praktisi Pengembangan Website Terhadap Peningkatan Kompetensi Industri 4.0 Pra-prakerin Siswa RPL SMK Medikacom Bandung.","Christian Adrianus siwabessy, Retno Indah Rokhmawati, Uun Hariyanti",pengaruh kesiapan sekolah kesiapan instruktur serta penggunaan django framework dan bootstrap 5 dalam pelaksanaan teaching factory praktisi pengembangan website terhadap peningkatan kompetensi industri 40 praprakerin siswa rpl smk medikacom bandung
Pengaruh Keterampilan Mengelola Kelas dan Kompetensi Pedagogik Mahasiswa PLP Program Studi Pendidikan Teknologi Informasi Universitas Brawijaya Terhadap Motivasi Belajar Siswa di SMK Negeri 4 Malang,"Mohammad Hafidz Hibadurrahman, Wibisono Sukmo  Wardhono, Uun Hariyanti",pengaruh keterampilan mengelola kelas dan kompetensi pedagogik mahasiswa plp program studi pendidikan teknologi informasi universitas brawijaya terhadap motivasi belajar siswa di smk negeri 4 malang
Pengaruh Koefisien Kopling dan Jarak Pada Pengembangan Sistem Penghantar Daya Nirkabel,"Gavin Argyatama Awandana, Sabriansyah Rizqika Akbar",pengaruh koefisien kopling dan jarak pada pengembangan sistem penghantar daya nirkabel
"Pengaruh Kualitas Layanan Website Terhadap Kepuasan Pengguna Menggunakan Metode WebQual 4.0 dan Importance Performance Analysis (IPA). (Studi Kasus: Departemen Teknik Elektro dan Informatika,  Universitas Negeri Malang)","Aghnia Azka Privanna, Satrio Hadi Wijoyo, Dwi Cahya Astriya Nugraha",pengaruh kualita layanan website terhadap kepuasan pengguna menggunakan metode webqual 40 dan importance performance analysis ipa studi kasus departeman teknik elektro dan informatika   universitas negeri malang
Pengaruh Lingkungan Keluarga Dan Self-Efficacy Terhadap Kesiapan Kerja Siswa Kelas XI Program Teknik Jaringan Komputer Dan Telekomunikasi SMK Negeri 5 Malang,"Muhammad Zidan Fikri Al Fauzi, Retno Indah Rokhmawati, Faizatul Amalia",pengaruh lingkungan keluarga dan selfefficacy terhadap kesiapan kerja siswa kelas xi program teknik jaringan komputer dan telekomunikasi smk negeri 5 malang
Pengaruh Media Pembelajaran IDE Replit menggunakan Problem Based Learning terhadap Hasil Belajar dan Motivasi Belajar Peserta Didik pada Informatika SMAN 3 Malang,"Serra Nadya Indi Herawati, Admaja Dwi Herlambang, Satrio Hadi Wijoyo",pengaruh medium pembelajaran ide replit menggunakan problem base learn terhadap hasil belajar dan motivasi belajar peserta didik pada informatika sman 3 malang
Pengaruh Media Pembelajaran Microlearning Berbantu Media Sosial TikTok Terhadap Motivasi Belajar dan Keterampilan Siswa Pada Mata Pelajaran Informatika di SMK Negeri 3 Malang.,"Afi Faridatul Haq  Faqih, Prima Zulvarina, Admaja  Dwi Herlambang",pengaruh medium pembelajaran microlearne berbantu medium sosial tiktok terhadap motivasi belajar dan keterampilan siswa pada mata pelajaran informatika di smk negeri 3 malang
Pengaruh Metode Problem-based Learning Berbantuan Github dan ChatGPT terhadap Hasil Belajar dan Computational Thinking Skill Siswa,"Tuffahati Sholihah, Admaja Dwi Herlambang, Satrio Hadi Wijoyo",pengaruh metode problembase learn berbantuan github dan chatgpt terhadap hasil belajar dan computational thinking skill siswa
"Pengaruh Minat Belajar, Motivasi Belajar, dan Gaya Belajar Siswa Terhadap Hasil Belajar Siswa Kelas XI Pada Mata Pelajaran Pemrograman Website Di SMKN 11 Malang","Ramadhan Mulia  Fajri, Satrio Hadi Wijoyo, Nurul Hidayat",pengaruh minat belajar motivasi belajar dan gaya belajar siswa terhadap hasil belajar siswa kelas xi pada mata pelajaran pemrograman website di smkn 11 malang
Pengaruh Model Flipped Classroom pada Mata Pelajaran Pemrograman Dasar terhadap Hasil Belajar Siswa Kelas X SMK Negeri 6 Malang,"Elsa Auliya  Rahma, Admaja Dwi Herlambang, Khalid Rahman",pengaruh model flip classroom pada mata pelajaran pemrograman dasar terhadap hasil belajar siswa kelas x smk negeri 6 malang
Pengaruh Model Kooperatif Teams Games Tournament terhadap Hasil Belajar Peserta Didik Menggunakan Platform Gamifikasi pada Mata Pelajaran Informatika di SMK Yapalis Krian,"Nurma Cici Wulandari, Admaja Dwi Herlambang, Tri Afirianto",pengaruh model kooperatif teams game tournament terhadap hasil belajar peserta didik menggunakan platform gamifikasi pada mata pelajaran informatika di smk yapalis krian
Pengaruh Model Pembelajaran Discovery Learning dengan Penerapan Media AhaSlides terhadap Hasil Belajar Peserta Didik Kelas X Mata Pelajaran Informatika SMKN 3 Malang,"Hana Rizkia Iswana Putri, Satrio Hadi Wijoyo, Khalid  Rahman",pengaruh model pembelajaran discovery learn dengan penerapan medium ahaslide terhadap hasil belajar peserta didik kelas x mata pelajaran informatika smkn 3 malang
Pengaruh Model Pembelajaran Flipped Classroom dengan Project Based Learning Terhadap Hasil Belajar Siswa Mata Pelajaran Basis Data di SMK Negeri 8 Malang,Yusrina Pradipta Andityarini,pengaruh model pembelajaran flip classroom dengan project base learn terhadap hasil belajar siswa mata pelajaran basis datum di smk negeri 8 malang
Pengaruh Model Pembelajaran Flipped-Classroom terhadap Hasil Belajar Pengetahuan Prosedural Siswa pada Mata Pelajaran Administrasi Infrastruktur Jaringan di SMK Negeri 2 Bombana,"Ririn Ririn, Admaja Dwi Herlambang, Aditya Rachmadi",pengaruh model pembelajaran flippedclassroom terhadap hasil belajar pengetahuan prosedural siswa pada mata pelajaran administrasi infrastruktur jaringan di smk negeri 2 bombana
Pengaruh Model Pembelajaran Kolaboratif Berbantuan Project Based Learning (PjBL) terhadap Hasil Belajar dan Kemampuan Kolaboratif Siswa pada Mata Pelajaran Pengembangan Perangkat Lunak dan Gim di SMKN 1 Kepanjen,"Elsya Diaz Deanova, Admaja Dwi  Herlambang, Prima Zulvarina",pengaruh model pembelajaran kolaboratif berbantuan project base learn pjbl terhadap hasil belajar dan kemampuan kolaboratif siswa pada mata pelajaran pengembangan perangkat lunak dan gim di smkn 1 kepanjen
Pengaruh Model Pembelajaran Project Based Learning Berbantuan Tutor Sebaya terhadap Keterampilan Berpikir Kreatif Siswa pada Mata Pelajaran Desain Komunikasi Visual Elemen Perangkat Lunak Desain di SMKN 5 Malang,"Fadwa Nazirah, Admaja Dwi Herlambang, Prima Zulfarina",pengaruh model pembelajaran project base learn berbantuan tutor sebaya terhadap keterampilan berpikir kreatif siswa pada mata pelajaran desain komunikasi visual eleman perangkat lunak desain di smkn 5 malang
Pengaruh Model Pembelajaran Snowball Throwing terhadap Prestasi Belajar Aspek Kognitif dan Afektif pada Materi Mikrotik Kelas XI Jurusan Teknik Komputer Jaringan (SMK Negeri 5 Malang),"Pratama Maulidi Ega Salim, Satrio Hadi Wijoyo, Aditya Rachmadi",pengaruh model pembelajaran snowball throw terhadap prestasi belajar aspek kognitif dan afektif pada materi mikrotik kelas xi jurusan teknik komputer jaringan smk negeri 5 malang
Pengaruh Motivasi Belajar terhadap Performa Mahasiswa Pasca Pandemi COVID-19,"Diva Ratna Kumala Ardellia, Aryo Pinandito, Yusi Tyroni Mursityo",pengaruh motivasi belajar terhadap performa mahasiswa pasca pandemi covid19
Pengaruh Pemanfaatan Media Pembelajaran Interaktif AhaSlides terhadap Hasil Belajar Siswa Mata Pelajaran Pemrograman Dasar pada Konteks Metode Pembelajaran Problem Based Learning,"Safira Luthfiana Husodo, Admaja Dwi Herlambang, Uun Hariyanti",pengaruh pemanfaatan medium pembelajaran interaktif ahaslide terhadap hasil belajar siswa mata pelajaran pemrograman dasar pada kontek metode pembelajaran problem base learn
Pengaruh Penerapan Flipped Classroom terhadap Motivasi Belajar dan Kemampuan Berpikir Kreatif Siswa pada Mata Pelajaran Desain Media Interaktif SMK Negeri 1 Blora,"Okky Prasetya Wibowo, Admaja Dwi Herlambang, Prima Zulvarina",pengaruh penerapan flip classroom terhadap motivasi belajar dan kemampuan berpikir kreatif siswa pada mata pelajaran desain medium interaktif smk negeri 1 blora
Pengaruh Penerapan Model Pembelajaran Flipped Classroom Berbantuan Edpuzzle terhadap Motivasi Belajar dan Hasil Belajar Mata Pelajaran Basis Data di Kelas XI SMK Negeri 6 Malang,"Edwin Samodra Pratama, Admaja Dwi Herlambang, Uun Hariyanti",pengaruh penerapan model pembelajaran flip classroom berbantuan edpuzzle terhadap motivasi belajar dan hasil belajar mata pelajaran basis datum di kelas xi smk negeri 6 malang
Pengaruh Penerapan Model Pembelajaran Teams Games Tournament Terhadap Hasil Belajar Peserta Didik Mata Pelajaran Informatika Di SMK 1 Pancasila Ambulu,"Ashila Gisara Dwinanda, Satrio Hadi  Wijoyo, Khalid  Rahman",pengaruh penerapan model pembelajaran team game tournament terhadap hasil belajar peserta didik mata pelajaran informatika di smk 1 pancasila ambulu
Pengaruh Penggunaan Aplikasi Tiktok sebagai Sumber Belajar Digital di dalam Implementasi Problem Based Learning terhadap Hasil Belajar Peserta Didik pada Mata Pelajaran Karya Desain di SMK Negeri 5 Malang,"Hedara Putri, Admaja Dwi Herlambang, Prima Zulvarina",pengaruh penggunaan aplikasi tiktok sebagai sumber belajar digital di dalam implementasi problem base learn terhadap hasil belajar peserta didik pada mata pelajaran karya desain di smk negeri 5 malang
Pengaruh Penggunaan Cerita Linear dan Nonlinear pada Gim Edukasi terhadap Peningkatan Literasi Grafik,"Faiz Ahmad Sucipto, Eriq Muhammad Adams Jonemaro, Agi Putra Kharisma",pengaruh penggunaan cerita linear dan nonlinear pada gim edukasi terhadap peningkatan literasi grafik
Pengaruh Penggunaan Media Pembelajaran Interaktif Quizizz Terhadap Motivasi dan Hasil Belajar Siswa pada Mata Pelajaran Pemrograman Dasar di SMK Negeri 3 Malang,"Yulia Husnathul Zanah, Admaja Dwi  Herlambang, Uun  Hariyanti",pengaruh penggunaan medium pembelajaran interaktif quizizz terhadap motivasi dan hasil belajar siswa pada mata pelajaran pemrograman dasar di smk negeri 3 malang
Pengaruh Penggunaan Media Pembelajaran Interaktif dalam Pembelajaran Problem Based Learning pada Mata Pelajaran Informatika Terhadap Hasil Belajar Siswa Kelas X di SMKN 3 Malang,"Vivian Alfida Puspaningrum, Prima Zulvarina, Admaja Dwi Herlambang",pengaruh penggunaan medium pembelajaran interaktif dalam pembelajaran problem base learn pada mata pelajaran informatika terhadap hasil belajar siswa kelas x di smkn 3 malang
Pengaruh Penggunaan Media Sosial Instagram sebagai Media Pembelajaran terhadap Minat dan Hasil Belajar Siswa dalam Kegiatan Microlearning pada Mata Pelajaran Produktif Teknik Komputer dan Jaringan di SMK Negeri 5 Malang,"Ahmad Fahrul  Romadlon, Admaja Dwi Herlambang, Aditya Rachmadi",pengaruh penggunaan medium sosial instagram sebagai media pembelajaran terhadap minat dan hasil belajar siswa dalam kegiatan microlearne pada mata pelajaran produktif teknik komputer dan jaringan di smk negeri 5 malang
Pengaruh Penggunaan Wordwall dalam Meningkatkan Hasil Belajar Siswa SMK Negeri 12 Malang Pada Mata Pelajaran Informatika,"Eiko Farah Diva Julen, Satrio Hadi Wijoyo, Khalid Rahman",pengaruh penggunaan wordwall dalam meningkatkan hasil belajar siswa smk negeri 12 malang pada mata pelajaran informatika
Pengaruh Pengiriman Paket Konstan dan Variabel di Lingkungan Wireless Mesh Network menggunakan Protokol Routing OLSR (Open Link-State Routing),"Riza Anisul Fu'ad, Dany Primanita Kartikasari, Rakhmadhany Primananda",pengaruh pengiriman paket konstan dan variabel di lingkungan wireless mesh network menggunakan protokol routing olsr open linkstate routing
Pengaruh Platform Visual Studio Code Terhadap Hasil Belajar Siswa pada Mata pelajaran Pemrograman Dasar Kelas X Jurusan Teknik Komputer dan Jaringan SMKN 3 Malang,"Dyah Yuliana Abidah, Satrio Hadi Wijoyo, Khalid Rahman",pengaruh platform visual studio code terhadap hasil belajar siswa pada mata pelajaran pemrograman dasar kelas x jurusan teknik komputer dan jaringan smkn 3 malang
Pengaruh Serangan Wormhole terhadap Kinerja Protokol Temporally Ordered Routing Algorithm (TORA) pada Mobile Ad Hoc Network (MANET),"Ravy Agistya Alkamaly, Primantara Hari Trisnawan, Reza Andria Siregar",pengaruh serangan wormhole terhadap kinerja protokol temporally order route algorithm tora pada mobile ad hoc network manet
Pengaruh Social Media Overload terhadap Produktivitas Belajar Mahasiswa,"Shandra Elvyra Sudarsono Putri, Aryo Pinandito, Yusi Tyroni Mursityo",pengaruh social medium overload terhadap produktivita belajar mahasiswa
Pengaruh Streamer Product Knowledge dan Streamer Image Terhadap Minat Beli Konsumen pada Live Shopping,"Ananda Rizki Oktavianti, Diah Priharsari, Welly Purnomo",pengaruh streamer product knowledge dan streamer image terhadap minat beli konsumen pada live shopping
Pengaruh Student Engagement dalam Project-Based Online Learning Bootcamp terhadap Kesiapan Kerja Mahasiswa di Era Industri 4.0,"Syahra Rizkia Andina, Aryo Pinandito",pengaruh student engagement dalam projectbase online learning bootcamp terhadap kesiapan kerja mahasiswa di era industri 40
Pengaruh Technology Acceptance Model Terhadap Behavioral Intention to Use Shopee Live Dengan Attitude Toward Using Sebagai Variabel Mediasi,"Mohammad Yusron Jauhari, Satrio Hadi Wijoyo, Himawat Aryadita",pengaruh technology acceptance model terhadap behavioral intention use shopee live dengan attitude sebagai variabel mediasi
Pengaruh Transfer Learning ResNet dan DenseNet Terhadap Performa Klasifikasi Ekspresi Wajah Menggunakan Dataset FER-2013,"Geoffrey Edmund Pierre Purba, Satrio Hadi Wijoyo, Nanang Yudi  Setiawan",pengaruh transfer learning resnet dan densenet terhadap performa klasifikasi ekspresi wajah menggunakan dataset fer2013
