title,penulis,cleaned_title
Eksperimen Penerapan Prinsip Konsistensi dan Prinsip Tipografi untuk Perbaikan Pengalaman Pengguna pada Halaman Utama Website Rizky Mandiri Travel,"Rayhan Hakeem, Agi Putra Kharisma, Nurudin Santoso",eksperimen penerapan prinsip konsistensi dan prinsip tipografi untuk perbaikan pengalaman pengguna pada halaman utama website rizky mandiri travel
Eksperimen Penerapan Progressive Disclosure Guna Meningkatkan  Pengalaman Pengguna Repository Brawijaya Knowledge Garden,"Elang Sotya Putra Dumipta, Agi Putra Kharisma, Muh. Arif Rahman",eksperimen penerapan progressive disclosure guna meningkatkan   pengalaman pengguna repository brawijaya knowledge garden
Eksperimen Penerapan React Context dan Redux Sebagai State Management Pada Framework React-JS,nalan ridlo,eksperimen penerapan react context dan redux sebagai state management pada framework reactjs
Eksperimen Penerapan Web Design and Usability Guidelines pada Online Public Access Catalog Universitas Brawijaya,"Azka Isnandaru Fajrina Mulya, Agi Putra Kharisma, Nurudin  Santoso",eksperimen penerapan web design usability guideline pada online public access catalog universitas brawijaya
Eksperimen Perbandingan Desain F-Pattern dan Z-Pattern Pada Perancangan Website AKAR Studio,"Bagus Dermawan Mulya, Agi Putra Kharisma, Adam Hendra Brata",eksperimen perbandingan desain fpattern dan zpattern pada perancangan website akar studio
Eksplorasi Pengaruh Live Shopping terhadap Minat Beli Konsumen dalam Berbelanja Online dengan Metode Systematic Literature Review,"Irtiyah Izzaty Mindiasari, Diah Priharsari, Welly Purnomo",eksplorasi pengaruh live shopping terhadap minat beli konsuman dalam berbelanja online dengan metode systematic literature review
Eksplorasi Perbandingan Pengaruh Metode Lossless Compression Terhadap Konsumsi Energi Pada Wireless Sensor Network,"Nusa, Agung",eksplorasi perbandingan pengaruh metode lossless compression terhadap konsumsi energi pada wireless sensor network
Eksplorasi Perilaku Mahasiswa dalam Implementasi Pembelajaran Hybrid di IT Telkom Surabaya,"Mohammad Dhani Alfian, Intan Sartika Eris Maghfiroh, Andi Reza Perdanakusuma",eksplorasi perilaku mahasiswa dalam implementasi pembelajaran hybrid di telkom surabaya
Eksplorasi Respon Mahasiswa terhadap Hasil Pengolahan Turnitin dan Aksi yang dilakukan untuk Menurunkan Hasil Turnitin,"Aidan Zahran Hudaya, Andi Reza Perdanakusuma, Tri Afirianto",eksplorasi respon mahasiswa terhadap hasil pengolahan turnitin dan aksi yang dilakukan untuk menurunkan hasil turnitin
Eksplorasi Skema Reproduksi Algoritma Genetika untuk Vehicle Routing Problem dengan Time Windows (Studi Kasus: Anekapay),"Haidar Hanif, Diva Kurnianingtyas, Agus Wahyu Widodo",eksplorasi skema reproduksi algoritma genetika untuk vehicle routing problem dengan time window studi kasus anekapay
"Ekstraksi Ciri pada Klasifikasi Citra Batik menggunakan Metode Gray Level Co-Occurrence Matrix, Local Binary Pattern, dan HSV Color Moment","Amar Ikhbat Nurulrachman, Randy Cahya Wihandika, Putra Pandu Adikara",ekstraksi ciri pada klasifikasi citra batik menggunakan metode gray level cooccurrence matrix local binary pattern dan hsv color moment
Ekstraksi Informasi pada Data Logbook KKN Mahasiswa Fakultas Ilmu Komputer Universitas Brawijaya Malang menggunakan Metode NER (Named Entity Recognition),"Maulana Raga Azizi, Widhy Hayuhardika Nugraha Putra, Issa Arwani",ekstraksi informasi pada data logbook kkn mahasiswa fakulta ilmu komputer universitas brawijaya malang menggunakan metode ner name entity recognition
Evaluasi Antarmuka Pengguna Media Pembelajaran Digital Pemrograman Dasar LetsCode dengan Metode Usability Testing dan Cognitive Walkthrough,"Achmad Afif Ubaydillah, Hanifah Muslimah Az-Zahra, Fitra Abdurrachman Bachtiar",evaluasi antarmuka pengguna media pembelajaran digital pemrograman dasar letscode dengan metode usability testing dan cognitive walkthrough
Evaluasi Aplikasi Gapura UB dengan Pendekatan Human Centered Design: Studi Kasus Peningkatan User Experience dan Usability,"Moch. Rifky Misbachudin, Lutfi Fanani, Mahardeka  Tri Ananta",evaluasi aplikasi gapura ub dengan pendekatan human center design studi kasus peningkatan user experience dan usability
Evaluasi Aspek Usability pada Situs MyAlkes menggunakan Metode Usability Testing dan System Usability Scale,"Patrick Jore Idota, Satrio Hadi Wijoyo, Yusi Tyroni Mursityo",evaluasi aspek usability pada situs myalke menggunakan metode usability testing dan system usability scale
Evaluasi Dan Perbaikan User Experience (UX) Pada Aplikasi Klinik UB Menggunakan Metode Heuristic Evaluation,"Muhammad Dhafin Firmansyah, Herman Tolle, Buce Trias Hanggara",evaluasi dan perbaikan user experience ux pada aplikasi klinik ub menggunakan metode heuristic evaluation
Evaluasi Desain Antarmuka Pengguna Sistem Surat Tugas Menggunakan Kerangka Kerja Goal-Directed Design: Kasus Filkom Apps,"Fachri Ramadhan, Ismiarta Aknuranda, Issa Arwani",evaluasi desain antarmuka pengguna sistem surat tugas menggunakan kerangka kerja goaldirecte design kasus filkom app
Evaluasi Flipped Classroom Berbantuan E-Learning Berbasis Gamifikasi Terhadap Motivasi Belajar dan Hasil Belajar Siswa SMK Negeri 3 Malang,"Amelia Intan Permatasari, Fajar Pradana, Admaja Dwi Herlambang",evaluasi flip classroom berbantuan elearne berbasis gamifikasi terhadap motivasi belajar dan hasil belajar siswa smk negeri 3 malang
Evaluasi Game Experience menggunakan Metode Game Experience Questionnaire (Studi Kasus: Gim Apex Legends Mobile),"Noverio Athariq Syafaz, Eriq Muhammad Adams Jonemaro, Mahardeka Tri Ananta",evaluasi game experience menggunakan metode game experience questionnaire studi kasus gim apex legend mobile
Evaluasi Hasil Belajar Problem Based Learning pada Mata Pelajaran Desain Multimedia Interaktif (Studi pada Siswa Jurusan Multimedia Kelas XII SMKN 12 Malang),"Tahmidya Kamila Putri Nicahya, Wibisono Sukmo Wardhono, Retno Indah Rokhmawati",evaluasi hasil belajar problem base learn pada mata pelajaran desain multimedia interaktif studi pada siswa jurusan multimedia kelas xii smkn 12 malang
Evaluasi Interaksi Pengguna pada Situs Web Mebiso dengan Metode Heuristic Walkthrough,"Mohamad Ariq Suryanugraha, Retno Indah Rokhmawati, Satrio Hadi Wijoyo",evaluasi interaksi pengguna pada situs web mebiso dengan metode heuristic walkthrough
Evaluasi Kesuksesan Implementasi Aplikasi Carik Jakarta pada Ekosistem Sistem Pemerintahan Berbasis Elektronik di DKI Jakarta Berdasarkan Teori Delone & McLean,"Rahayu Dwi Nuraini, Admaja Dwi  Herlambang, Widhy Hayuhardhika Nugraha  Putra",evaluasi kesuksesan implementasi aplikasi carik jakarta pada ekosistem sistem pemerintahan berbasis elektronik di dki jakarta berdasarkan teori delone   mclean
Evaluasi Kesuksesan Layanan Website Eduakksa Berdasarkan Teori DeLone and McLean Model,"Putri Daliana Salsabilla Rais, Admaja Dwi Herlambang, Buce Trias Hanggara",evaluasi kesuksesan layanan website eduakksa berdasarkan teori delone mclean model
Evaluasi Kualitas Dan Kesuksesan Implementasi Layanan Akademik Mahasiswa Membangun Desa Universitas Brawijaya Berdasarkan Teori Technology Acceptance Model Dan Delone And Mclean’s Model,"Gheri Jelita, Admaja Dwi Herlambang, Widhy Hayuhardhika Nugraha Putra",evaluasi kualitas dan kesuksesan implementasi layanan akademik mahasiswa membangun desa universitas brawijaya berdasarkan teori technology acceptance model dan delone mclean model
Evaluasi Kualitas Website IKIP Budi Utomo Malang menggunakan Metode Webqual 4.0 dan Importance Performance Analysis (IPA),"Amrta Ageng Subarkah, Retno Indah Rokhmawati, Bondan Sapta Prakoso",evaluasi kualita website ikip budi utomo malang menggunakan metode webqual 40 dan importance performance analysis ipa
Evaluasi Model Algoritma Klasifikasi Terhadap Data Website Eling Fakultas Ilmu Komputer Universitas Brawijaya,"Muhammad Ibrohim, Aswin Suharsono, Satrio Hadi Wijoyo",evaluasi model algoritma klasifikasi terhadap datum website eling fakulta ilmu komputer universitas brawijaya
Evaluasi Pelayanan Publik di Kampung Kayutangan Heritage Berdasarkan Analisis Sentimen dan Root Cause Analysis (RCA),"Tikta Adristi, Nanang Yudi Setiawan, Satrio Hadi Wijoyo",evaluasi pelayanan publik di kampung kayutangan heritage berdasarkan analisis sentimen dan root cause analysis rca
Evaluasi Penerimaan Layanan Aplikasi LolosASN Berdasarkan Teori Technology Acceptance Model,"Deswita Marsya Nadia, Admaja Dwi Herlambang, Buce Trias Hanggara",evaluasi penerimaan layanan aplikasi lolosasn berdasarkan teori technology acceptance model
Evaluasi Pengalaman Pemain Pada Gim Hades Menggunakan Ubisoft Perceived Experience Questionnaire,Ataka Badrudduja,evaluasi pengalaman pemain pada gim hade menggunakan ubisoft perceive experience questionnaire
Evaluasi Pengalaman Pengguna Game King of Crabs menggunakan Game Experience Questionnaire,"Mohamad Galvin Ivandi, Eriq Muhammad Adams Jonemaro, Mahardeka Tri Ananta",evaluasi pengalaman pengguna game king crabs menggunakan game experience questionnaire
Evaluasi Pengalaman Pengguna pada Aplikasi  Sirekap Mobile Menggunakan Metode Enhanced  Cognitive Walktrough (Studi Kasus : Kantor KPU  Kabupaten Pamekasan),"Windaliani Wahyudin, Ismiarta Aknuranda, Alfi Nur  Rusydi",evaluasi pengalaman pengguna pada aplikasi   sirekap mobile menggunakan metode enhance   cognitive walktrough studi kasus   kantor kpu   kabupaten pamekasan
Evaluasi Pengalaman Pengguna pada Aplikasi PermataMobileX dengan Metode Enhanced Cognitive Walkthrough,"Admi Faris Farhan, Hanifah Muslimah Az-Zahra, Buce Trias Hanggara",evaluasi pengalaman pengguna pada aplikasi permatamobilex dengan metode enhance cognitive walkthrough
Evaluasi Pengalaman Pengguna pada LMS E-Learning UIN Malang menggunakan Metode UX Curve dari Sudut Pandang Pengajar (Studi Kasus: Dosen Jurusan Psikologi Universitas Islam Negeri Maulana Malik Ibrahim Malang),"Muhammad Naufal Afif, Hanifah Muslimah Az-Zahra, Diah Priharsari",evaluasi pengalaman pengguna pada lms elearne uin malang menggunakan metode ux curve dari sudut pandang pengajar studi kasus dosen jurusan psikologi universita islam negeri maulana malik ibrahim malang
Evaluasi Performa dan Pengalaman Pengguna Situs Web Menggunakan Google Lighthouse dan User Experience Questionnaire (UEQ): Kasus pada Situs Fakultas Perikanan dan Ilmu Kelautan Universitas Brawijaya,"Salsabila Nur Malahayati, Ismiarta Aknuranda, M. Ali Fauzi",evaluasi performa dan pengalaman pengguna situs web menggunakan google lighthouse dan user experience questionnaire ueq kasus pada situs fakulta perikanan dan ilmu kelautan universitas brawijaya
Evaluasi Performa dan Pengalaman Pengguna Situs Web Sebuah Fakultas Ilmu Komputer Menggunakan Google Lighthouse dan User Experience Questionnaire (UEQ),"Muhammad Afif Maulana, Ismiarta Aknuranda, M. Ali  Fauzi",evaluasi performa dan pengalaman pengguna situs web sebuah fakulta ilmu komputer menggunakan google lighthouse dan user experience questionnaire ueq
Evaluasi Playtesting Gim A Space for the Unbound menggunakan Mechanic Dynamic Aesthetic Framework,"Muhammad Haikal Fisabilillah, Eriq Muhammad Adams  Jonemaro, Tri Afirianto",evaluasi playtesting gim space unbound menggunakan mechanic dynamic aesthetic framework
Evaluasi Playtesting pada Gim Valorant dengan Pendekatan Mechanics Dynamics Aesthetics Framework,"Bramantyo Raka Adi Nugroho, Eriq Muhammad Adams Jonemaro, Muhammad Aminul Akbar",evaluasi playtesting pada gim valorant dengan pendekatan mechanics dynamic aesthetic framework
Evaluasi Proses Bisnis Administrasi Akademik pada Institusi ABC dengan menggunakan Quality Evaluation Framework (QEF),"Troy Kornelius Daniel, Andi Reza Perdanakusuma, Niken Hendrakusma Wardani",evaluasi prose bisnis administrasi akademik pada institusi abc dengan menggunakan quality evaluation framework qef
Evaluasi Proses Bisnis Administrasi Pelayanan Akademik Semester Antara pada Fakultas Ilmu Komputer Universitas Brawijaya (FILKOM UB) dengan Metode Quality Evaluation Framework (QEF),"Nisriinaa 'Aaliyah, Intan Sartika Eris Maghfiroh, Tri Afirianto",evaluasi prose bisnis administrasi pelayanan akademik semester antara pada fakulta ilmu komputer universitas brawijaya filkom ub dengan metode quality evaluation framework qef
Evaluasi Proses Bisnis Pencatatan Perubahan Status Perkawinan di Disdukcapil Kota Surabaya Menggunakan Metode Six Sigma,"Maria Nicole Natasha Putri Iriandi, Intan Sartika Eris Maghfiroh, Yusi Tyroni Mursityo",evaluasi prose bisnis pencatatan perubahan status perkawinan di disdukcapil kota surabaya menggunakan metode sigma
Evaluasi Proses Bisnis Penjualan Produk Pusat Penelitian Perkebunan Gula Indonesia Menggunakan Business Process Improvement (BPI),"Wildan Aulia Mu'tashim, Herman Tolle",evaluasi prose bisnis penjualan produk pusat penelitian perkebunan gula indonesia menggunakan business process improvement bpi
Evaluasi Proses Request Fulfillment Dan Problem Management Sistem Informasi Pada PSIK Fakultas Ilmu Komputer Universitas Brawijaya Menggunakan Framework ITIL,"M. Adlant Nazhari Yahyasamdie, Suprapto, Aditya Rachmadi",evaluasi prose request fulfillment dan problem management sistem informasi pada psik fakulta ilmu komputer universitas brawijaya menggunakan framework itil
Evaluasi Strategi Social Sharing terhadap Jumlah Traffic pada Website  PAUD Asoka,"Salsha Thaulinzky, Fajar  Pradana, Widhy Hayuhardhika Nugraha Putra",evaluasi strategi social sharing terhadap jumlah traffic pada website   paud asoka
Evaluasi Sumber Daya Teknologi Informasi Perusahaan menggunakan COBIT 5 (Studi Kasus: PT 24Slides Design Studio),"Nilna Minhatillah, Ismiarta Aknuranda",evaluasi sumber daya teknologi informasi perusahaan menggunakan cobit 5 studi kasus pt 24slides design studio
Evaluasi Tata Kelola Teknologi Informasi Menggunakan Framework COBIT 5 Pada Domain BAI (Studi Kasus: CV Siap Integrasi),"Farhan Zaki Putra, Aditya Rachmadi, Andi Reza Perdanakusuma",evaluasi tata kelola teknologi informasi menggunakan framework cobit 5 pada domain bai studi kasus cv siap integrasi
Evaluasi Tata Kelola dan Manajemen Risiko Teknologi Informasi menggunakan Framework COBIT 2019 proses EDM03 dan APO12 (Studi Kasus pada PT Bank BRI Unit Bangorejo),"Kelvin Irawan, Buce Trias Hanggara, Suprapto Suprapto",evaluasi tata kelola dan manajemen risiko teknologi informasi menggunakan framework cobit 2019 prose edm03 dan apo12 studi kasus pada pt bank bri unit bangorejo
Evaluasi Tata Kelola dan Manajemen Risiko Teknologi Informasi pada PT. Kreatiful Digital Indonesia menggunakan Framework COBIT 2019,"Sakti Dewangga, Buce Trias Hanggara, Suprapto Suprapto",evaluasi tata kelola dan manajemen risiko teknologi informasi pada pt kreatiful digital indonesia menggunakan framework cobit 2019
Evaluasi Usability Antarmuka Pengguna pada Aplikasi Mobile E-Open Disdukcapil Kota Bekasi Dengan Metode Usability Testing dan Heuristic Evaluation,"Okta Vaherdi, Hanifah Muslimah Az-Zahra, Almira Syawli",evaluasi usability antarmuka pengguna pada aplikasi mobile eopen disdukcapil kota bekasi dengan metode usability testing dan heuristic evaluation
Evaluasi Usability Aplikasi PERSADA: Sistem Monitoring Pajak Daerah di Kota Malang,"Aulia Septy Anggraini, Hanifah Muslimah  Az-Zahra, Admaja Dwi Herlambang",evaluasi usability aplikasi persada sistem monitor pajak daerah di kota malang
Evaluasi Usability Aplikasi Pengklasifikasian Biji Kopi dan Prediksi Harga Kopi “Discoffery” menggunakan Metode Usability Testing,"Ilham Setyo  Nugroho, Hanifah Muslimah Az-Zahra, Kariyoto Kariyoto","evaluasi usability aplikasi pengklasifikasian biji kopi dan prediksi harga kopi "" discoffery "" menggunakan metode usability testing"
Evaluasi Usability Aplikasi Perangkat Bergerak Sipindo menggunakan Metode Think Aloud dan Heuristic Evaluation,"Prasetyo Margaret Wibisono, Retno Indah Rokhmawati, Buce Trias Hanggara",evaluasi usability aplikasi perangkat bergerak sipindo menggunakan metode think aloud dan heuristic evaluation
Evaluasi Usability Aplikasi Soulmath dengan Menggunakan Metode Usability Testing,"Yakhya Nahnul Saputro, ha Muslimah Az-Zahra, Tri Afirianto",evaluasi usability aplikasi soulmath dengan menggunakan metode usability testing
Evaluasi Usability Aplikasi e-Partisipasi Pemerintahan di Kota Malang menggunakan Metode Heuristic dan Think Aloud,"Yossy Risco Andisela, Bondan Sapta Prakoso, Yusi Tyroni Mursityo",evaluasi usability aplikasi epartisipasi pemerintahan di kota malang menggunakan metode heuristic dan think aloud
Evaluasi Usability Fitur Manajemen Naskah Dinas pada Aplikasi UB Apps,"Rifdah, Ismiarta  Aknuranda, Retno Indah Rokhmawati",evaluasi usability fitur manajemen naskah dinas pada aplikasi ub app
Evaluasi Usability Pada Aplikasi M-Banking NTB Syariah Dengan Metode Usability Testing (Studi Kasus: NTB Syariah Sumbawa Besar),"Zakiyah Rima Damayanti, Retno Indah Rokhmawati, Faizatul Amalia",evaluasi usability pada aplikasi mbanke ntb syariah dengan metode usability testing studi kasus ntb syariah sumbawa besar
Evaluasi Usability Sistem Informasi Kearsipan Dinamis Terintegrasi (SRIKANDI) Versi 3: Kasus di Politeknik Kesehatan Kemenkes Malang,"Leli Purwanti, Ismiarta  Aknuranda, Alfi Nur Rusydi",evaluasi usability sistem informasi kearsipan dinamis terintegrasi srikandi versi 3 kasus di politeknik kesehatan kemenkes malang
Evaluasi Usability Sistem Informasi TSES (Thursina Smart Education System) menggunakan Usability Testing dan System Usability Scale,"Irfan Nuril Faza, Satrio Hadi Wijoyo, Intan Sartika Eris Maghfiroh",evaluasi usability sistem informasi tse thursina smart education system menggunakan usability testing dan system usability scale
Evaluasi Usability dan Perbaikan Antarmuka Pengguna Website Badan Pelayanan Pajak Daerah Kabupaten Sidoarjo,"Rafidah Arafahni Miladi, Buce Trias Hanggara, Bondan Sapta Prakoso",evaluasi usability dan perbaikan antarmuka pengguna website badan pelayanan pajak daerah kabupaten sidoarjo
Evaluasi Usability dan Perbaikan Pengalaman Pengguna Situs Media Sosial Profesional menggunakan Evaluasi Heuristik dan Usability Testing: LinkedIn,"Angga Nasetya Caesara Putra, Ismiarta Aknuranda, Buce Trias Hanggara",evaluasi usability dan perbaikan pengalaman pengguna situs medium sosial profesional menggunakan evaluasi heuristik dan usability testing linkedin
Evaluasi Usability dan Perbaikan User Experience Aplikasi BIMO Mahasiswa Menggunakan Usability Testing dengan Pendekatan Human-Centered Design (HCD),"Muh Handri Kiswanto, Aryo  Pinandito, Lutfi Fanani",evaluasi usability dan perbaikan user experience aplikasi bimo mahasiswa menggunakan usability testing dengan pendekatan humancentered design hcd
Evaluasi Usability dan Perbaikan User Experience Aplikasi M-Paspor Menggunakan Pendekatan 4D Framework,"Avidhyana Sukma Valenta, Agi Putra Kharisma, Herman Tolle",evaluasi usability dan perbaikan user experience aplikasi mpaspor menggunakan pendekatan 4d framework
Evaluasi Usability pada Aplikasi (Mobile) Juragan 99 Trans dengan Pengujian Usability,"Widya Estrella, Ismiarta Aknuranda",evaluasi usability pada aplikasi mobile juragan 99 trans dengan pengujian usability
Evaluasi Usability pada Aplikasi Discord di Indonesia menggunakan Metode Usability Testing,"Jonathan Eratmoko Widito, Satrio Agung Wicaksono, Mochamad Chandra Saputra",evaluasi usability pada aplikasi discord di indonesia menggunakan metode usability testing
Evaluasi Usability pada Situs Web Dinas Kependudukan dan Pencatatan Sipil Kota Surabaya menggunakan Metode Heuristic Evaluation,"Andrio A. Arrazzaq, Hanifah Muslimah Az-Zahra, Fais Al Huda",evaluasi usability pada situs web dinas kependudukan dan pencatatan sipil kota surabaya menggunakan metode heuristic evaluation
Evaluasi Usability terhadap Aplikasi Informasi Perkara “SIAP-PATRIA” Pengadilan Agama Blitar menggunakan Metode Usability Testing,"Fahmi Izza Hasbi, Hanifah Muslimah Az-Zahra, Bondan Sapta Prakoso","evaluasi usability terhadap aplikasi informasi perkara "" siappatria "" pengadilan agama blitar menggunakan metode usability testing"
Evaluasi User Experience Aplikasi Pariwisata menggunakan Metode Usability Testing dan User Experience Questionnaire (UEQ) (Studi Kasus: Banyuwangi Tourism dan Visiting Jogja),"Mukhlis Murtadho, Herman Tolle",evaluasi user experience aplikasi pariwisata menggunakan metode usability testing dan user experience questionnaire ueq studi kasus banyuwangi tourism dan visit jogja
Evaluasi User Experience Pada Aplikasi JOOX Mobile Menggunakan Metode Diary Study,"intan melathi, Hanifah Muslimah Az-Zahra, Alfi Nur Rusydi",evaluasi user experience pada aplikasi joox mobile menggunakan metode diary study
Evaluasi User Experience dengan mengadaptasi Mecue Questionnaire pada Aplikasi Reseller (Studi Kasus pada Aplikasi Evermos),"Ringgo Abriovenandita, Retno Indah Rokhmawati, Diah Priharsari",evaluasi user experience dengan mengadaptasi mecue questionnaire pada aplikasi reseller studi kasus pada aplikasi evermos
Evaluasi User Experience pada Aplikasi BCA Mobile dan MyBCA dengan menggunakan Metode Usability Testing dan User Experience Questionnaire (UEQ),"Hansen Natanael, Aryo Pinandito, Mochamad Chandra Saputra",evaluasi user experience pada aplikasi bca mobile dan mybca dengan menggunakan metode usability testing dan user experience questionnaire ueq
Evaluasi User Experience pada Aplikasi Belanjaparts Menggunakan Metode Human Centered Design,"Muhammad Alvin Nur Irfany, Hanifah Muslimah  Az-Zahra, Almira  Syawli",evaluasi user experience pada aplikasi belanjapart menggunakan metode human center design
"Evaluasi User Experience pada Layanan Pesan Antar menggunakan Metode User Experience Questionnaire (UEQ) (Studi Kasus: Gofood, Grabfood, dan Shopeefood)","Debora Malau, Hanifah Muslimah Az-Zahra, Ismiarta  Aknuranda",evaluasi user experience pada layanan pesan antar menggunakan metode user experience questionnaire ueq studi kasus gofood grabfood dan shopeefood
Evaluasi User Experience pada Website QRIS.id dengan menggunakan Metode User Experience Quesionnaire (UEQ),"Achmad Ichsan Fauzi, Mahardeka Tri Ananta, Lutfi Fanani",evaluasi user experience pada website qrisid dengan menggunakan metode user experience quesionnaire ueq
Evaluasi dan Pemodelan Proses Bisnis Dalam Mengatasi Ketidakseimbangan Permintaan dan Pasokan Minyak Goreng (Studi Kasus: PT. Al-Muawanah Kurnia Jaya),"Andrei Hansel Zacharias, Yusi Tyroni Mursityo, Intan Sartika Eris Maghfiroh",evaluasi dan pemodelan prose bisni dalam mengatasi ketidakseimbangan permintaan dan pasokan minyak goreng studi kasus pt almuawanah kurnia jaya
Evaluasi dan Pemodelan Proses Bisnis pada Proses Pengiriman Barang di Divisi Operasional PT Mitra International Tbk,"Najwa Huwaidah, Buce Trias Hanggara, Dwi Cahya Astriya  Nugraha",evaluasi dan pemodelan prose bisnis pada proses pengiriman barang di divisi operasional pt mitra international tbk
Evaluasi dan Perancangan Pengalaman Pengguna Aplikasi Mobile Kursus Public Speaking (Oberi App) menggunakan Metode Shadowing dan Design Thinking,"Oktaviani Dwi Nur  Aini, Lutfi Fanani, Tri Afirianto",evaluasi dan perancangan pengalaman pengguna aplikasi mobile kursus public speak oberi app menggunakan metode shadowing dan design thinking
Evaluasi dan Perbaikan Alur dan Navigasi Situs Web Indonesia.go.id sebagai Media E-Government Public Relations (GPR) Kementerian Komunikasi dan Informatika (Kemenkominfo) dengan Menggunakan Pendekatan Tree Testing dan Card Sorting,"Manuel Nicholas, Hanifah Muslimah Az-Zahra, Almira Syawli",evaluasi dan perbaikan alur dan navigasi situs web indonesiagoid sebagai medium egovernment public relation gpr kementerian komunikasi dan informatika kemenkominfo dengan menggunakan pendekatan tree testing dan card sort
Evaluasi dan Perbaikan Antarmuka Pengguna Aplikasi Portal Kajian Risiko Bencana InaRISK Personal menggunakan Metode Human Centered Design,"Muqorrobin Ghulam Muhammad, Ismiarta Aknuranda",evaluasi dan perbaikan antarmuka pengguna aplikasi portal kajian risiko bencana inarisk personal menggunakan metode human center design
Evaluasi dan Perbaikan Antarmuka Pengguna Website SMK Negeri 5 Malang menggunakan Pendekatan Human Centered Design (HCD),"Firda Destiara, Hanifah Muslimah Az-Zahra, Almira Syawli",evaluasi dan perbaikan antarmuka pengguna website smk negeri 5 malang menggunakan pendekatan human center design hcd
Evaluasi dan Perbaikan Desain Antarmuka Pengguna Aplikasi E-Library Kota Blitar menggunakan Metode Human-Centered Design,"Aditya Wahyu Ramadhani, Satrio Hadi Wijoyo, Bondan Sapta Prakoso",evaluasi dan perbaikan desain antarmuka pengguna aplikasi elibrary kota blitar menggunakan metode humancentere design
Evaluasi dan Perbaikan Desain Antarmuka Pengguna Sistem Persetujuan Colocation Application Form (CAF) menggunakan Metode Human Centered Design (Studi Kasus: PT Tower XYZ),"Hafia Azzahra, Hanifah Muslimah Az-Zahra, Yusi Tyroni  Mursityo",evaluasi dan perbaikan desain antarmuka pengguna sistem persetujuan colocation application form caf menggunakan metode human center design studi kasus pt tower xyz
Evaluasi dan Perbaikan Desain Antarmuka Pengguna Situs Web SMA Negeri 1 Kraksaan menggunakan Metode Website Usability Evaluation Tool (WEBUSE) dan Human Centered Design (HCD),"Risky Ayuningdias, Satrio Hadi Wijoyo, Hanifah Muslimah Az-Zahra",evaluasi dan perbaikan desain antarmuka pengguna situs web sma negeri 1 kraksaan menggunakan metode website usability evaluation tool webuse dan human center design hcd
Evaluasi dan Perbaikan Desain Antarmuka Pengguna Website DPD PPNI Kabupaten Malang menggunakan Pendekatan Design Thinking,"Gitahayu Pradipta, Retno Indah Rokhmawati, Intan Sartika Eris Maghfiroh",evaluasi dan perbaikan desain antarmuka pengguna website dpd ppni kabupaten malang menggunakan pendekatan design thinking
